"review_no","product_id","createDate","userNickName","content","grade"
"73077200","2493838","2025-04-12","옵티미스틱","멋부리거나 꾸몃을 때 뿌리기 좋은 것 같아요. 강한 남자의 향이 나고 묵직합니다. 뿌리고 나면 뭔가 원목 나무가 생각나는거 같아요!!","4"
"73026449","2493838","2025-04-11","꽃빛","퍼퓸이라 그런지 지속력은 나쁘지 않고 가성비도 괜찮은데.. 향이 오묘하고.. 근데 가족들은 홍삼 냄새 같다고 웃픈 향 ㅠㅠ 다른 향수랑 레이어링해서 사용해볼 생각입니다.","3"
"73003775","2493838","2025-04-10","thaini","익숙힌 가죽향입니다. 살짝 상큼한 향도 섞여 있어서 무난하게 자주 쓸 수 있을 것 같아요.","5"
"72832943","2493838","2025-04-05","비비드한고글","진하고 묵직한 우디향이 두세번 펌프에도 아주 강렬하네요 시간이 흐르면 부드럽게 변하는 향이 좋습니다","5"
"72755269","2493838","2025-04-03","펭귄은조류","그라펜 향수 중에서 이 향이 가장 좋습니다. 가을 겨울 강추합니다","5"
"72722265","2493838","2025-04-02","후련한리스본힙본","중성적인향을 좋아해서 할인도하길래 구입해봤어요
남성용 향수느낌이 강하지만 잔향이 괜찮네요","4"
"72706836","2493838","2025-04-02","방태우","우드향이 좀 세긴하지만 스타일에 따라 뿌리기 좋습니다","4"
"72444944","2493838","2025-03-24","정우동이","향이 좋고 디자인도 심플해서 이뻐요, 자주 쓰게 되네요","5"
"72425967","2493838","2025-03-24","강 창현","향이 너무 좋습니다. 뿌렸을때도 좋은데 저는 개인적으로 잔향이 너무 맘에 드네요!!","5"
"72372315","2493838","2025-03-22","요즘대세미국소품","아침에 출근할때 뿌리고 퇴근할때까지 
향도 오래가고 향도 너무 좋아요
고민하고 계신다면 고민하지말고 꼭 사세요!","5"
"72316607","2493838","2025-03-20","김느좋","첫향은 좀 쎄지만 뒤에 나는 잔향이 좋아서 미리 뿌려두면 좋습니다","5"
"72015086","2493838","2025-03-12","훌륭한광주플리츠","지속력 좋고 가볍게 뿌리기 좋습니다.
자칫 많이뿌리면 홍삼냄새 날수있어서 적게 뿌리다보니 오래쓸수있어요.","5"
"71993793","2493838","2025-03-11","원ㅎㅖ","처음에 나는 향보다 시간이 지난 후에 남는 잔향이 너무 좋아서 이불에 종종 뿌려요 ㅎ.ㅎ","5"
"71937273","2493838","2025-03-10","e.z.el","남성스러운 향이고 무거운편이라 겨울에 사용하기 좋은 향이에요ㅎㅎ","5"
"71920620","2493838","2025-03-09","흐아하","가격댜에 비해 가죽향과 우디한 향이 좋았던 거 같아요","4"
"71888385","2493838","2025-03-08","맵고짜고쓴거","향은 중성적이고 흔하지는 않은 향입니다 호불호 있겠지만 저는 굉장히 맘에드네용 잔향이 정말 좋습니다","5"
"71817797","2493838","2025-03-06","명성있는신촌키링","잔향이 고급스러운 우디향이라 좋네요.
가격이 저렴해서 가성비로 데일리로 뿌리기 아주 좋을거 같아요.
다 쓰면 또 구매할거 같아용ㅎㅎ","5"
"71579642","2493838","2025-02-27","곧억만장자","타투 퍼퓸이라는 이름이 걸맞게 확실히 지속력이나 확산력은 정말 좋은것 같아요! 다만 그러다보니 첫향이 좀 쎄게 느껴지는점도 분명히 있어서 시향해보시고 구매하는걸 추천드립니다 :)","4"
"71526100","2493838","2025-02-25","트렌디한마포후디","후기보고 구매했는데요 성공했어요
잔향이든 첫향이든 좀 오래가는게 좋거든요
가격대비 향도 깊고 중성적인 향 너무 마음에 들어요
명품향수 많이 써봤지만 남들이 좋다고 다 좋은건 아니더라구요
가격도 너무 쌔고
아직까지  그라펜이 자주 손이 가고 만족스럽더라구요
가격 믿고 다른향도 써 보고 싶어요","5"
"71251281","2493838","2025-02-17","오궁맨","벌써 두번 째 구매입니다. 묵직하니 너무 만족합니다.","5"
"73367583","4747737","2025-04-21","H.space","제가 선택한 향은 렙틸 디스코 입니다 고민했는데 좀 더 머스크한 향을 좀 선호하긴해서 선택했네요 패키징은 전체적으로 
깔끔했습니다 다만 뚜껑이 좀 타이트하긴 하더라구요 
그 외에는 실버에 깔끔한 화이트라벨에 뚜껑까지 세련되게
느껴졌습니다 향은 전체적으로 여성분들이 더 잘 어울릴만한
소프트한 느낌이였고 개인적으론 강한 남성 향수보다는 좀 더 중성적인 향을 선호해서 더 좋았습니다 탑에서 과일향처럼 단 향이 났고 시간이 지나면서 바닐라랑 아몬드 향도 느껴지더라구요
시간이 지난 후 향이 더 괜찮았습니다 봄 코디에 너무 잘 어울리는 향이라 요새 잘 뿌리고 다니고 있습니다","5"
"73365005","4747737","2025-04-21","o로미o","향수에는 잘모르는데, 길에 지나다니다 보면 참 상큼하다 냄새가 좋다 다시한번 그사람 처다보는향수가 이향수에요.
딩첨된거도 기쁘고 향기도 좋고 그러내요 병원에서 오랜 투병생활하다 잠시 퇴원했는데 그나마 얼마남지않은 외출생활
향수 팍팍 뿌려써야겠네요 당첨 넘감사드립니다
향수에는 잘모르는데, 길에 지나다니다 보면 참 상큼하다 냄새가 좋다 다시한번 그사람 처다보는향수가 이향수에요.
딩첨된거도 기쁘고 향기도 좋고 그러내요 병원에서 오랜 투병생활하다 잠시 퇴원했는데 그나마 얼마남지않은 외출생활
향수 팍팍 뿌려써야겠네요 당첨 넘감사드립니다
향수에는 잘모르는데, 길에 지나다니다 보면 참 상큼하다 냄새가 좋다 다시한번 그사람 처다보는향수가 이향수에요.
딩첨된거도 기쁘고 향기도 좋고 그러내요 병원에서 오랜 투병생활하다 잠시 퇴원했는데 그나마 얼마남지않은 외출생활
향수 팍팍 뿌려써야겠네요 당첨 넘감사드립니다","5"
"73364628","4747737","2025-04-21","HMDS-638","⚫️ 향
키스라는 브랜드의 이름과 어울리는 달톰하면서 고급스러운 향입니다. 처음부터 끝까지 베리의 달콤한 향과 럼의 고급스러운 향이 어우러지면서 매혹적인 분위기를 줄 수 있을 것 같습니다. 개인적인 생각으로는 여성분들이 뿌리시면 것 같습니다.


⚪️ 지속력
부향률 개인적으로 사용해봤을 때 손등에 뿌렸을 때 7~8 시간 정도 지속됬던 것 같습니다. 


⚫️ 디자인
디자인은 은색 병에 흰 뚜껑인데, 내부가 보이지 않는 향수는 처음보지만 생각보다 이쁜 것 같습니다. 디자인이 감각적이어서 인테리어 로도 좋을 것 같습니다.

⚪️ 총평
벤츠라는 브랜드 이미지에 걸맞는 고급진 향이 은은하고 부드럽게 오랜시간 지속되는 세련된 향수인 것 같습니다.","5"
"73325682","4747737","2025-04-19","닉ㄴㅔ읨","향수를 체험해볼 줄은 몰랐는데 좋은 기회 감사합니다! 아몬드라는향이 생소해서 궁금하긴 했지만 실패할까봐 돈 주고는 못 샀는데 이번 기회에 체험단으로 선정되어 뿌려보니 이 가격대 향이라고는 생각이 안 들었어요. 향이 강한 걸 선호하지 않는데 이 향수는 좀 우아하다? 라는 느낌이 들 정도로 은은한 머스크 향이 잔향으로도 온 종일 지속되서 좋았어요. 머리 아플 수 있는 머스크향에 달달한 바닐라향이 첨가되니 불호인 사람 없이 누구나 사용하기 좋은 향수인 것 같습니다. 향 자체가 무겁거나 가벼운 느낌이 들지 않아서 계절 상관없이 뿌리기에도 좋은 것 같아요. 이 정도 가격대에 고급진 향을 원하시는 분들에게 추천 드립니다 ㅎㅎ 같이 선택할 수 있었던 생베리 향도 궁금해지네여 좋은 체험 기회 주셔서 감사합니당 향 좋고 오래 지속되며 호불호 없는 향이에요!","5"
"73322633","4747737","2025-04-19","이바다야","첫향은 쇠맛나는 딸기잼? 레플리카 레이지 인 더 모닝인가 여기서도 쇠향이 나는데 비슷한 느낌 베이스는 딸기잼인데 걍 딸기잼 아니고 제로슈가 느낌입니다 첫향과 크게 달라지진 않지만 옅은 단내가 마지막까지 나요 지속력은 기대 안하고 일부러 10번 넘게 팍팍 뿌렸는데 6시간은 거뜬합니다 그 이후는 나만 맡을수 있을정도? 보틀 디자인도 깔끔하니 이쁩니다 향수 체험단은 처음이라 무슨 사진을 찍어야될지 감이 안오는데 일단 찍어봅니다 올영에서 시향해보시고 구매 추천드려요 단내 좋아하시면 강추입니다","5"
"73256407","4747737","2025-04-17","닭발나라순대공주","체험단 매일신청하면서 향수는처음받아보는데요 받자마자 뜯어봤는데 아주 아담하니 내스타일이에요 직장에두고다니면서 뿌릴려구요 향수를잘안쓰는타입인데 요건한번뿌르자마자 아몬드향이 고소하게 느껴져요 참기름은아니고 ㅋ약간 바닐라랑 믹스된향이라 저한텐딱이에요 올영에서 시향한번해보고 구매한거라 생베리보단 바닐라향이짱인거같아요 나이거아까워서어케써요? 향 전달이됐을지모르겠는데 따뜻한향이에요 구매해보세요 체험단이이어도 전 호불호가확실한데 구매한번해보세요 제가 전달한향이 이느낌이였구나 생각하실거에요 근데 과대포장 하..ㅋ","4"
"73200084","4747737","2025-04-16","퇴사원chu","우선 디자인부터 제 취향을 저격한 향수입니다.
포장을 제거하고 본품을 보는 그 자체만으로도 되게 고급진 선물받은것 같아 기분이 좋아져요 ! 🤍🤍
첫향을 맡았을때는 스파이시함이 가장 강하게 느껴져서 남녀가 다 사용할 수 있는 유니섹스향수라고 느껴졌어요. 설명에 사랑은 산딸기가 되었다고 적어주셨는데 조향사분이 어떤걸 표현하려고 하셨는지 시간이 흐름에따라 강하게 다가옵니다. 점점 물기를 머금은 듯한 베리향이 진득하게 올라오고 마지막 바닐라 향으로 마무리까지 .. 이 향수는 쌀쌀해지는 날씨에 뿌리면 가장 좋을듯해요 🩶🩵","5"
"73194422","4747737","2025-04-16","오예스치즈","처음 뚜껑을 열었을 때, 달콤한 바닐라와 고소한 아몬드 향이 마치 갓 구운 마카롱을 떠올리게 했어요. 따뜻하고 부드러운 첫인상에 기분까지 포근해지는 기분! 시간이 지날수록 은은하게 퍼지는 달큰함이 매력적이라, 마치 쿠키 굽는 오후 햇살 아래 앉아 있는 기분이 들어요. 향수 케이스도 고급스러운 느낌의 은색 코팅 마감이라 책상 위에 올려두기만 해도 인테리어 효과까지! 아침에 뿌리고 나가면 하루 종일 기분이 사르르 녹아요. 나만 알고 싶은 향수지만, 살짝 자랑하고 싶은 욕심도 드네요. 겨울엔 따뜻함을, 봄엔 부드러움을 더해줄 데일리 향수로 강추!
사용기한도 넉넉해서 오래 아껴쓸 수 있을것 같아요.","5"
"73192684","4747737","2025-04-16","Qschid","키스라는 향수 브랜드를 무신사를 통해 처음 접해 보게 되었습니다. 케이스 디자인  일단 너무 이쁘네요. 젊은 디자인이라 휴대하기에도 예쁘네요. 랩틸 디스코라는 향은 아몬드-바닐라 향처럼 그야말로 진하고 달달 그자체입니다. 따뜻한 향이라 저는 가을,겨울 추천해요. 바닐라 향이 일단 굉장히 진해서 러블리한 이미지라 개인적으로 여성적인 러블리한 향수라고 생각합니다. 마치 달달한
케익을 연상시키는 바닐라와 아몬드의 조합이랄까요. 굉장히 따뜻한 이미지 사람을 연상시키는 그런 F같은 향입니다.
너무 가볍지 않고 머리 아프지도 않아서 하루종일 기분좋은 향기로 보낼수 있었습니다. 잔향은 조금씩 남게 되면서 가벼운 캔디향 정도 귀여운 느낌 이에요.
우디함도 살짝 담겨 있어서 중요한 날에 꼭 뿌리고 싶은 향수입니다.
키스라는 향수 브랜드 너무나 괜찮네요 앞으로도 또 만나보고 싶은 브랜드입니다.","5"
"73190167","4747737","2025-04-16","ssarchiv","키스라는 브랜드를 처음 알게 되었는데 택배 상태부터 본품 포장까지 너무 깔끔하게 잘 왔습니다!
선물하기 좋은 고급스러운 패키지에 본품 디자인도 실버+화이트로 너무 예뻤어요 :)
가장 중요한 향기! 럼과 베리가 섞였다는 설명처럼 베리 향으로 달콤하면서도 럼 향이 눌러줘서 마냥 가벼운 단 향이 아닌 살짝의 무게감과 분위기가 느껴지는 향기입니다
럼향이 섞여서 그런지 약간 꽃과 풀, 줄기의 향이 동시에 나는듯 한 느낌도 납니다
분사력도 좋았어요! 가볍게 눌러도 잘 퍼지는 분사력이 좋았고 입구에 향수가 흐르거나 하지도 않았습니다","5"
"73183733","4747737","2025-04-15","힙을리","배송 엄청 빨리오고! 언박싱 하면서 설레였어요
*어디서 분명 맡아본 익숙한 향인데 생각이 잘 안나요..
백화점1층에서 무조건 1번은 맡아본 향인데.
(생로랑쪽인 것 같은데. .)
여튼! 외관 넘 깔끔하고 심플하게 생기지 않았나요?
(쉿)다만 개인적으로는 안이 보이는 형태를 더 선호해요
남여 노소 가리지않고 데일리 하게 쓸 수 있는 향인 것 같고, 전 탑노트보다 잔향이 더 마음에 들었어요 은은한 느낌

개인적 취향은 우디한 향을 선호 하는데 생베리는 이름 그대로 좀 달달한 향이에요
왠지 남자들이 여자들한테 이런 향 나면 좋아할 것 같은 느낌?
그것도 케바케 이긴 하겠지만 소개팅 갈때 뿌릴 것 같은 그런 향이에요~ 참 말로설명 하기 어렵넹..
그치만 향 좋은 사람의 느낌이랄까? 발랄 하기도 하면서 포근한.. 그런","5"
"73174703","4747737","2025-04-15","fakelove","올해 우리나라는 4월부터 11월까지 여름이 될것이라고 기상 전문가가 예측했다고 해요.
그래서 여름에 쓰기 좋고 특별한 향기를 찾고 있었는데 체험단에 당첨되어 후기를 남겨보도록 하겠습니다.
외관상 굉장히 깔끔하고 심플하면서도 세련된 디자인이 돋보입니다.

Top Note 배, 만다린, 핑크 페퍼
Middle noto 장미, 럼, 라즈베리
Base note 오크우드, 바닐라, 파촐리

향은 클래식한 산뜻한 플로럴향이 나면서 시간이 지나면 술에 절여진 베리류를 연상케 합니다.
지속력이 길고 은은하게 잔향이 오래 남고 기분 좋은 달콤한 향이다 보니 하루 종일 킁킁 맡게 해요. 

차분하고 우아한 이미지를 가지신 분한테 어울릴 것 같고 또 향수 입문 초기로도 남녀 부담없이
쓸 수 있을 정도로 호불호가 없을 것 같아요. 제가 진한 향수는 정말 꺼려하거든요. 근데 이 향수는
은은하게 달달한 향이 퍼지면서 마지막에 머스크로 따뜻하게 감싸줘서 좋아요. 그리고 평소에 남편이 쓰던 조말x 블랙베리향과 비슷한 향이 난다고 좋다며 자기가 쓰고싶다고 하네요. 사계절 내내 뿌려도 좋을 만큼 선물로 받으면 너무 좋을 것 같아서 남동생한테도 생일선물로 주려고 합니다. 올리브영에서도 판매하고 있으니 시향하셔서 득템하시길 바랍니다.","5"
"71211546","4502387","2025-02-16","촤르르","미드나잇향을 너무 좋아해서 다른향은 어떨까 싶어서 구매했는데, 다 괜찮네요! 휴대용으로 들고 다니기 좋아요!","5"
"71148430","4502387","2025-02-14","뚜뚜..","여기 브랜드 향수 사고싶었는데
그전에 시향해보려고 사써요","5"
"71080465","4502387","2025-02-12","MAGGIE89","6am 향기 너무 좋고 큰거로 구매할까
고민주민중이엥요 ~","5"
"71068423","4502387","2025-02-12","장마엔동묘샘플","여러향을 체험해 볼 수 있어서 좋아요. 6am이 취향이더라구요","5"
"70998857","4502387","2025-02-10","브라보~!","미드나잇 향 초ㅣ고... 다음에는 미드나잇으로 사야겠어욥","5"
"70653245","4502387","2025-02-02","CHIUYU","향수 향이 너무 좋아요
데일리하게 활용하기 좋은","5"
"70579369","4502387","2025-02-01","Wj22","친구 생일 선물로 샀어요. 선물용으로 좋은거같습니다","5"
"70523017","4502387","2025-01-30","혜똥ㅇ","너무 잘 쓰고 있어요 향 자체가 세지 않아서 은은하게 잘 가요","5"
"70288028","4502387","2025-01-26","피오나29","이 제품 큰사이즈 사기전에 시향을 해보려고 구매했어요.","5"
"70073094","4502387","2025-01-16","게으른베를린엣지","3mL로 양이 많아 충분히 시향해 볼 수 있습니다.
우디하고 얼씨한 6am, 귤 그자체인 3pm이 마음에 들어요","5"
"69971696","4502387","2025-01-14","uujungf","시향 해보고 구매하시는 걸 추천드립니다. 손이 잘 안가요","4"
"69965094","4502387","2025-01-14","76☆","세트로 사서 기분따라 암거나 뿌릴 수 있어서 좋슴니다 근데 향이 진짜 금방 날아가요 들고다니면서 뿌려야댐","5"
"69873897","4502387","2025-01-11","맑은제노바쿠션","여러 향을 사용할 수 있어서 좋아요!
이 중 3pm향 큰 걸로 주문할려고용","5"
"69611525","4502387","2025-01-04","sunw00_","어떤 향으로 살지 고민하다가 세트 있길래 이걸루 향 맡아보고 결정하려고 구매했는데 향이 다 좋아요..😽","5"
"69530751","4502387","2025-01-02","최애의광화문쇼핑","어떤걸 살지 고민되신다면 디스커버리 세트사서 본인이 좋아하는거 사기 좋습니다.","5"
"69527844","4502387","2025-01-02","디버깅또디버깅","여러 향 시향 해 볼 수 있어서 만족스럽구요, SW19은 처음인데 전반적으로 다 만족스럽슴다","5"
"69240623","4502387","2024-12-23","인준1","향수를 좋아해서 구매했어요. 다 써보고, 제일 좋은 걸로 정착할 생각입니다!","5"
"69193410","4502387","2024-12-22","야옥운","디스커버리 세트 덕분에 궁금했던 향을 알 수 있어서 좋았습니다. 패키지도 이쁩니다.","4"
"68627153","4502387","2024-12-09","tamtamO","향수 4종에 대해 짧게 설명드립니다
6am 한약 느낌이 좀 나는 오드 향입니다
3pm 시트러스 감귤류 편안한 레몬향이 느껴집니다
Twilight 가벼운 머스크 향과 시큼한 머스크가 어우러진 느낌
Midnight 완전 비누향이라기보단 약간은 파우더리한 경향이 있음
","5"
"67375209","4502387","2024-12-01","팍팍한핑크키링","본품 사기 전에 미니로 여러 향 시향 해보고 사고 싶어서 샀는데 맘에 들어요
좋아하는 향도 들어있어서 좋아요","5"
"67364623","4502387","2024-11-23","TRAN QUYNH","이렇게 향수의 미니 세트를 사는 걸 정말 좋아해요. 큰 병을 사기 전에 SW19의 향을 여러 가지 써보고 어떤 향을 좋아하는지 알게 되었어요. 4 가지 향수를 써보더니 midnight 제일 좋아해서 50ml 병도 주문했어요 ","5"
"67345279","4502387","2024-11-23","새침한칠레오프너","냄새가 비슷하면서도 은은하게 다 다른 느낌이라 너무 좋아요 ","5"
"67012941","4502387","2024-11-14","D1e","솔직히 말하자면 3pm빼고는 다 제 춰향이 아니였어요…","2"
"66706215","4502387","2024-11-06","MJWSB","다양한 향으로 구성 되어있고 선물하게에 좋을것같아요","5"
"66524494","4502387","2024-11-01","토마우","여러가지 향을 시향할 수 있어서 좋아요!! 다만 양은 정말 적어서 몇번 못 쓸 것 같지만 휴대용으로는 좋아요","5"
"65773156","4502387","2024-10-20","완벽한멜버른코트","향을 다양하게 맡을 수 있어서 좋았고 바뀐 구성도 맘에 들어요","5"
"74065043","1937359","2025-05-11","아원플래티넘","향이 정말 상쾌하고 오래 가네요. 일상에서 사용하기 딱 좋습니다!","5"
"73755447","1937359","2025-05-02","탄탄이씨","향기가 너무 좋고 지속력 짱이에요! 데일리로 쓰기에 딱이에요.","5"
"72894191","1937359","2025-04-07","공손한종로컷팅","생각보다 물향이 강해서 별로엿어요..비오는날만 뿌리고잇어요","3"
"72247183","1937359","2025-03-18","어진진짜라","향도 은은하게 메론 수박 같은 향이나서 정말좋습니다","5"
"72074756","1937359","2025-03-13","는는는는","겨울이라 아직 많이 사용하진 않았지만 여름되면 사용하려합니다","5"
"71417022","1937359","2025-02-22","eun_do","클린 웜 코튼만 사용하다 처음 레인을 구매해 보았는데 잔향도 괜찮고 비온 뒤 우드향이 섞인 향이라 여전히 잘 사용하고 있습니다","4"
"70200732","1937359","2025-01-20","지구 대존잘","이 향수는 오프라인으로 맡아보고 향이 마음에 들어서 구매를 결정하게 됐습니다
클린에서 전개하는 라인들이 모두 기본은 하는만큼 이 제품도 향이 매우 좋고 레인이라는 이름에 걸맞게 적당히 무거우면서도 가벼운 말로 형용하기 힘든 향이 납니다
비오는날 뿌리면 분위기가 멋져 자신에게 취하는 모습을 볼 수 있을겁니다. 감사합니다.","5"
"69291829","1937359","2024-12-25","아련한버건디치크","처음나는 향이랑 시간이 좀 지나고 나는 향이 다른데 다 너무 좋습니다! 처음엔 시원하고 나중에는 점점 달아지네요~~","5"
"69059619","1937359","2024-12-18","naogds","올리브영에서 시향 해본 뒤에 무신사가 더 저렴해서 여기서 구입함. 향 좋음","5"
"68162965","1937359","2024-12-03","노란색넥타이","생각보다 향이 달달해서...ㅋ 그래도 멜론 수박향 이런거 좋아하는 편이라 가끔 사용합니다. ","5"
"67451815","1937359","2024-11-25","호단이","역시 최애 향..! 다른 향수 다 맡아봐도 이거만한 취향이 없어요 다만 지속력은 좋지않습니다!","5"
"66783905","1937359","2024-11-07","Coincide","레인 제가 젤 좋아하는 향이여서 여러 번 구매합니다","5"
"66716735","1937359","2024-11-06","hhyk","냄새가 너무 좋고 비오는날 최고향숩니다 ㅎㅎ 추천드려요","5"
"65837629","1937359","2024-10-22","더 니모","오이비누 냄새를 좋아해서
애용하는 향수임
근데 취향이 바뀌었는지 이젠 좀 느끼하게 느껴짐
예전보다 오이비누 향도 덜 나는 거 같고
오히려 플로럴 같음 ㅠㅠ
머지 ㅠ","5"
"65795408","1937359","2024-10-20","잉여519","선물한 제품이었는데 마음에 드는 향인것같아 다행입니다","4"
"65764553","1937359","2024-10-19","drunkenmiu","여름에 딱 좋고 겨울에는 좀 가벼워요~ 그래도 너무 좋아요!!","5"
"65562172","1937359","2024-10-15","알리크","깔끔한 물향? 메론향? 느낌나면서 클린 특유의 느낌있음.","5"
"63160368","1937359","2024-07-30","내일은캐나다도트","내가 쓸건아니고 친구 선물로 사줬는데 좋아해유 굿굿","5"
"63008564","1937359","2024-07-26","기발한그린골지","출근할 때 가볍게 잘 사용하고 있는 향수예요! 무덥거나 비오는 날 뿌리면 쾌적하고 상쾌한 느낌입니다. ","5"
"59859402","1937359","2024-05-25","충실한오슬로컷팅","시향했을 땐 워터향이 더 많이 났는데 받아보니 아직 안정화가 덜 돼서인지 달달한 냄새가 더 강하게 나요

변색인지는 모르겠으나 완전 투명은 아닌 노란빛 도는 향수네요","5"
"59271141","1937359","2024-05-12","몰디브트렌치","약간 물 냄새가 나고 향은 좋습니다! 워터멜론향 근데 지속력이 약한거 같아요 2-3시간 후면 다 날라가있네요","5"
"59017208","1937359","2024-05-07","뉴뉴나비","비오는날 뿌리기 딱좋은 워터멜론 시원한향♡ 달달해서 호불호갈릴수도있지만 전 너무 만족합니당","5"
"58532284","1937359","2024-04-27","김주겸","향 너무 좋고 비오는날 짱입니드아
가격 너무 착하고 ","5"
"57392679","1937359","2024-03-31","친근한피사트윌리","처음에 알로에?같은 향이다가 잔향은 생각보다 진한향이였어욤","4"
"55214174","1937359","2024-02-06","충충찌","킁캉킁캉 너무 좋아요 내가 뿌려도 기분좋아지는향이라서 만족합니당","5"
"54948610","1937359","2024-01-30","유능한칠레안경테","클린향수 중에 이향을 가장 좋아해서 몇번씩 쓰고 있어요! 
마음에 들어요!","5"
"54938600","1937359","2024-01-30","발리곰","평범한 향. 자극적이지 않고 샤워한 후에 뿌려주고 있어요. 오이향 강함. 비누로 씻었을 때의 향 느낌","4"
"54226012","1937359","2024-01-09","비제37","향이 너무 진하지않고 무난해서 아무날에나 데일리로 쓰고있어요","5"
"53095839","1937359","2023-12-13","레벳","평상시 데일리로 쓰고 있어요 !
젠더리스해서 남여 사용해도 괜찮은 것 같아요","5"
"51535688","1937359","2023-11-23","hathu2408","딱 제가 좋아하는 향입니다. 향이 너무 strong하지 않고 깨끗한 비누향이 나서 맘에 들어요","5"
"51225711","1937359","2023-11-16","뭉짱구","올리브영에서 냄새맡고 좋아서 구매했습니당ㅎㅎ 진짜 비오는날 딱 어울리는 향이에요!","5"
