"review_no","product_id","createDate","userNickName","content","grade"
"45839645","1446834","2023-07-11","열정적인동묘뮬","요건 그냥 집에 뿌려요.
무난한 향이라 화장실에도 뿌리고.","5"
"44390108","1446834","2023-06-11","꽁꽁언한강고양이","깔끔한 룩에 잘 어울리는 향이네요. 저렴하게 잘 구매했습니다.","5"
"50560895","1446834","2023-11-02","웃상인텍사스프릴","향 너무 좋은데 지속시간이 조금 짧아 아쉽습니다","5"
"42618490","1446834","2023-05-04","바람직한민트양말","오.. 생각보다 향이 진해요. 시트러스보단 파우더느낌이 더 강하게 남는 거 같아요. 시트러스 좋아하는 저한테는 조금 아쉬운 부분이지만 가벼운 느낌이라 봄여름에 잘 활용할 수 있을 거 같아요","5"
"41159259","1446834","2023-03-30","usveuoesco","기대안하고 구입했다가 향이 너무 좋아서 재구매 했어요! 지속력이 짧은것같은데 또 옷에서는 냄새가 하루종일 남.. ","5"
"38173155","1446834","2023-01-16","sse_.07","말이 필요 없을 정도로 제가 좋아하는 향이예요!!
뭐랄까 비누향도 나면서.. 어쨌든 뽀송한 향이 나요!
특히 잔향이 너무우 좋습니다ㅏㅏ!","5"
"16277261","1446834","2021-04-17","Ruddlwl","첫 향은 뭐지 싶었는데 알콜 날아가고 나니 잔향이 진짜 좋아요 비누향? 같은 포근한 향이 납니다 어디서 좋은 냄새 나는가 했는데 저한테 나는거였어요 싸게 잘 산것같아서 만족합니당","5"
"9866347","1446834","2020-05-26","LoverBoy.","향기도 호불호 안갈릴 것같고 너무 좋네요 정말 막 씻은듯한 향 강추합니다!","5"
"63088721","1446834","2024-07-28","차카게살까말까","향기가 좋다는 후기를 보고 쿠폰써서 싸게 구매 했는데요
네. 막 쓰기 좋은템 입니다.

비싼건 막 쓰지 못하고 독한 향은 많이 못뿌리는데
이건 막 뿌려요

첨엔 방향제 같은 향이 났다가 목욕탕에서 나온 향이 나요 옛감성에 들어갈수 있는템","4"
"61270264","1446834","2024-06-25","명확한고글","머리아픈 형이고 상큼함 1도 없어요
주변인들도 별로라고 하네요ㅠㅠ
저렴해서 다른 형애 도전해봅니다","2"
"59490634","1446834","2024-05-17","닉네임,,,","생각보다 엄청 단 향이에요... 비누 냄새, 꽃이랑 과일 냄새에 남자도 쓰기 괜찮다길래 무난할 줄 알았는데 남자가 이걸..? 은은한 느낌은 아니고 오래 맡으면 머리 아픈 향...","3"
"49192189","1446834","2023-10-05","브릿지서뉴","일단은 향이 좋다는 리뷰가 많았는데
정말 좋으네요!!^^
과일향 같으면서도 꽃향 같기도 하고,
기분이좋아지는 향이에요!!
바로 뿌리고 나가고싶어지네요!!♡
약간 중성의 느낌이라서 더 좋은것 같아요!
","5"
"18266832","1446834","2021-07-14","고당도체리","비누 냄새~ 갓 샤워하고 온 느낌 ㅋㅋ 다들 샴푸 뭐 쓰냐고 물어봐요 ㅠ..ㅎ","4"
"68929663","1446834","2024-12-25","1ovememore","청사과향을 강조하길래 구매한건데 청사과향은 처음 뿌렸을 때 잠깐 지나가고 끝이라 아쉬웟오요","3"
"61086294","1446834","2024-06-22","이엠티비","10대들이 쓰기 좋은향 재구매의사는 없어요! 아쉽","5"
"59732752","1446834","2024-05-22","kozizi7","지속력 짧음 주의 향 좋음주의 여름에 가볍게 쓰기좋음 두개살껄","5"
"59206695","1446834","2024-05-10","오보깅o","장미향 섬유유연제 냄새입니다 조금씩 자주 뿌리면 좋을 것 같아요","5"
"55980164","1446834","2024-02-23","기가막힌살구색뮬","처음 살때 향수 계속 눌러도 안나옴. 10분동안 두드리니까 겨우 나옴. 생각보다 향 무난하고 별로..... ","3"
"55923361","1446834","2024-02-22","Jmrnt","같은 브랜드의 센슈얼 터치만 쓰다가 이것두 한번 사봤어요. 향은 되게 달달하고 상큼해요. 근데 계속 맡다 보면 차량 방향제 냄새 같기도 해서 조금은 어지럽네요. 재구매는 안할거 같아요","4"
"55145831","1446834","2024-02-04","딸랑이쥬","쿠폰적용해서 저렴하게 잘 구입했어요. 무난하게 어디든 잘 어울리는 향이에요.","5"
"53908483","1446834","2023-12-31","엥버터","늘 쓰던 향수인데 왜인지 유독 이번에 프레시한 느낌은 줄고 더 중성적인 남자 스킨향 느낌이 강해진 기분이 드네요😅아마 제 기분탓인것 같지만 이번을 마지막으로 보내줘야할것같습니다","5"
"52310252","1446834","2023-12-01","진중한판교오글리","예전부터 사용해보고 싶었던 제품이라 구매했어요!
역시나 향이 좋네요~ 은은하고 남녀 모두 사용할 수 있는 제품인 것 같아요! 잘 사용힐께뇽!!","5"
"51994267","1446834","2023-11-28","오고롱","도브 비누향 입니다 제가 코가 좀 예민한 편이라 향은 좀 쎄게 느껴지긴 했지만 은은하게 갑니다 ! 추천 드려요","4"
"51900685","1446834","2023-11-27","금당24","기대를 많이 해서 그런가 그냥 평범한 비누향 향수였어요...무난하고 좋습니다","4"
"51732805","1446834","2023-11-25","mer!","장미향이 생각보다 강해요. 그것 외엔 워터리한 향이 좋아서 만족합니다.","5"
"51531325","1446834","2023-11-23","사민트","비누향, 여름에 뿌릴 가벼운 향수 고른다면 추천합니다 샤워나고 나왔을때가 느껴지는 향이라 가볍게 뿌리기 좋을만한 향수네요","5"
"50070214","1446834","2023-10-23","cafrey","레르 드 사봉 제품 중에 제일 인기있는데 왜 그런지 알 것 같습니다. 향 진짜 좋아서 계속 뿌리고 싶어용!","5"
"48399535","1446834","2023-09-16","ssibang","향도너무좋구 아주만족스러운구입입니다 다른향도구입예정입니다","5"
"47643801","1446834","2023-08-27","J_0n","향이 너무좋습니다 금방 날라가는 느낌이긴하지만 향은 최고네요 ","5"
"47584577","1446834","2023-08-26","오리덕쿵","
향 엄청 좋아요 블라인드라 고민했는데 고민할 이유가 없었네요!
","5"
"46845150","1446834","2023-08-06","온스온","향 참 좋은데 입구컷이네요 비누향이 무난무난한데 지속력 너무 아쉽습니다 향은 좋아요","4"
"46842619","1446834","2023-08-06","김예진진진진","디자인이 너무 예뻐서 구매했는데 딱 한번만 조금! 뿌려야돼요
두번 뿌렸더니 머리 아플정도로 진하네요....ㅠㅠ
향은 여름에 딱 제격입니다 먼가 아빠화장품 향같기도 해요
올 여름에 잘 사용할 것 같습니다
","4"
"46222821","1446834","2023-07-20","도비는 외근중","배송 너무 빨라서 좋았습니다
노란색은 샴푸향이 난다길래 같이 구입했어요","4"
"45772555","1446834","2023-07-09","태태태짱","진짜 바디워시 그 자체임
걍 일반적인 바디워시 냄새라 보면 됨 
난 실망임 좀 더 상큼할줄","4"
"44362852","1446834","2023-06-10","셋슈","케이스가 이뻐서 구매해봤는데. 향 너무좋네요.구매평 믿을만 합니다.다만 누를때 잘 안눌러지기도 함 5번중에 1번정도","4"
"43766845","1446834","2023-05-27","zerqsum","완전 호불호 안 갈리는 향이고 너무 좋아여,, 뿌리면 주변에서 많이 물어봄","5"
"43641696","1446834","2023-05-25","1444444","만족합니다 친구가 추천해줘서 샀는데 가격도 저렴하고 좋은거 같아요, 맘에 듭니다","5"
"43047194","1446834","2023-05-13","아르으미","일단 배송이 엄청 빨라서 좋고 가격도 저렴하고 향도 은은해서 데일리로 쓰기 좋습니다 ","5"
"42629045","1446834","2023-05-04","zmchen","향은 비누처럼 자연스러운 향이에요!디자인이 마음에 들어요!","5"
"42554872","1446834","2023-05-02","뿌엥송","어디에나 휘뚜루마뚜루 잘어울려요&gt;_&lt; 남자가 쓰기에도 좋고 여자가 쓰기에도 좋습니다ㅎㅎ 추천!","5"
"42375475","1446834","2023-04-28","sthdgie","쎄고 무거운 향을 안 좋아하시면 이 향수 완전 추천합니다!! 은은하니 계속 맡고 싶은 향이네요","5"
"38658706","1446834","2023-01-28","12344555321","향이 아주 상큼 달달 하고 좋네요ㅠㅜ!!
자몽과복숭아향이 잘 어울려서 
청량한 여름분위기를 연상시켜요
겨울보단 여름이나 봄에쓰면 좋을것 같은 향수입니다~~","5"
"32015873","1446834","2022-09-04","오늘은경복궁취향","후기가 좋아서 믿고 구매한건데 처음 맡았을 때는 뭐지 싶다가도 다시 맡으니까 너무 좋더라구요!","5"
"31442911","1446834","2022-08-18","맑은서촌코튼","향기 너무좋아요ㅠㅠ
은은하고...사랑스러움
남녀 모두 호불호없이 사용가능
무난무난해요~ 꾸안꾸향기💙","4"
"76711539","3920147","2025-07-11","은밀한오슬로치크","잔향이 그렇게 좋다는 모르겠는데 그냥 데일리로 쓰기 무난한 제품입니다 왜 유명한지는 잘모르겠어요 그냥 일반향수와 비슷합니다","4"
"76665000","3920147","2025-07-10","옷좀그만_사","항상 쓰던 건데 무신사에서 할인된 가격으로 구매했어요 내 20대를 보낸 향수 ,, 질리지 않고 너무 좋아요 지속력도 좋은 편이에요 이거 뿌린 날에는 향 좋다는 소리 꼭 들음","5"
"76641599","3920147","2025-07-09","시크한휴스턴벨트","착한가격에 구매하였고,은은한 향이여서 여름에 사용하기 좋아요","5"
"76614342","3920147","2025-07-08","앤틱한분홍포멀","향기가 은은하게 잘 나고 주변에서 좋다고 물어봐요 다 쓰면 또 살 예정 이에요","5"
"76535713","3920147","2025-07-06","D_wo","예전부터 좋아하던 향이라 여름맞이 구매했어용
전 머스크 같이 중성적인 향이 취향이라 이 향수가 제 기준에서 꽤 여성스러운 향이라고 생각했는데 친구들은 남자스킨 냄새가 난다고도 하더라구요 😅 그래도 전 만족스러워용
머스크랑 꽃이 섞이 향이예요 머리 안아파서 좋습니다","5"
"76502771","3920147","2025-07-05","기몽초","제 최애 향수에요, 독하지 않은 맑은 장미향이라 좋아요, 지속력도 길어요 출근할 때 뿌리면 퇴근까지 남아있어요","5"
"76395387","3920147","2025-07-02","다야아아아아","배송 빨라서 너무 좋았습니다. 향도 정말 좋아요 여성스러우면서 여름에 잘 어울려요! 지속력도 나쁘지 않은 것 같습니다. 샘플도 같이 주는데 샘플은 가지고 다니면서 잘 사용할 것 같아요! 대만족입니다 ㅎㅎ","5"
"76365981","3920147","2025-07-02","피가끓는검정리본","비가 오는 날에는 뿌리기 조금 힘든 느낌이구 화창한 날씨에 뿌리기 조아여 약간 초봄에서 초여름 사이에 뿌리기 가장 적절한 느낌입니당 근데 올리브영에서 샀던 바디미스트랑 냄새가 똑같드라구요…? 그래도 지속력은 이 향수가 더 길어서 잘 쓸 것 같네욤","4"
"76246217","3920147","2025-06-29","위즈원루비글래시지구미","선물했는데요 생각보다 냄새가 괜찮다고 하네요","5"
"76079658","3920147","2025-06-26","소박한명동레이스","향 너무 좋고 포장이 예뻐서 깔 때 기분 좋고 선물용으로도 좋을 것 같아요!! 샘플이 너무 귀여워서 소장가치 있어요","5"
"76057818","3920147","2025-06-25","편안한하늘색시계","배송이 빨리 왔고 향도 생각했던 것 보다 더 가볍고 여성스러운 향이라 좋았어요. 베르사체 다른 향수를 쓰고있어서 시향 안 햐보고 구매했는데 가볍게 뿌리고 다닐 때 좋을 것 같아요.","5"
"76037907","3920147","2025-06-25","알찬분홍겨울쿨톤","올리브영에서 뿌려보고 무신사 세일하길래 바로 구매했는데
너무 향이 좋아요~향이 오래가는듯해요
딸램이랑 같이 뿌리려고 샀는데 마음에 들어요
상큼하고 꽃향도 나고 바람이 불면 제 향기가 넘 좋아서 기분이 좋아지네요~","5"
"76029040","3920147","2025-06-25","호시나우타우","향 너무 좋아서 맨날 뿌림💗 여자소녀공주핑크향이남💕💕","5"
"75982287","3920147","2025-06-25","정연왕비._.","처음엔 알코올냄새 난다 싶은데 여러번 뿌리고 시간지나면 너무 페미닌하고 성숙한 여름향기 나서 좋아요!!
후기에 좋다고 써있어도 직접 냄새 맡아보고 사고싶어서 주변 올영매장가서 맡고 샀어요
블프때사서 거의반값에 삼 ㅎㅎ","5"
"75925719","3920147","2025-06-24","블링여사","미니어처 쓰다가 향이 좋아서구매함
지속력은 보통
여성여성하네요","4"
"75759144","3920147","2025-06-21","!?!?!?!?!?!?","꽃 냄새 나고 처음 뿌렸을 때보다는 잔향이 더 좋고 오래가니까 계속 애용할 거 같아요","5"
"75680505","3920147","2025-06-20","미묘한청계천점퍼","약간 샴푸향 같고 비오는 여름날에 찰떡인 향수예요.","5"
"75664466","3920147","2025-06-20","정원주인_","....그래도 조금은 기대했는데 너무 저렴한 향이 납니다. 구매가 후회돼요.","2"
"75612637","3920147","2025-06-19","404uninstall","향따 두번이나 당한 향수... 지속력도 오래 가고 여름에 뿌리기 좋아요!","5"
"75513365","3920147","2025-06-18","활발한신사패드","계속 사서 쓰는 중인네 너무 좋아요 4번째 구매중","5"
"75432507","3920147","2025-06-17","정직한발리치크","향이 은은하게 오래가서 좋은 것 같아요. 그러며 작은 것도 있어서 휴대하기 좋았습니다.","5"
"75309988","3920147","2025-06-15","연희조","향이 무겁지 않아서 요즘 더운데도 데일리로 잘 뿌리고 다닙니다!! 가을 되기 전까지는 꾸준히 쓸 거 같아용","5"
"75298166","3920147","2025-06-14","댄디한검정오글리","향 너뮤 좋아요!! 다 쓰면 또 사고싶음 근데 향이 너무 빨리 사라져","5"
"75267251","3920147","2025-06-13","내사랑하니","향 은은해서 좋아요. 자주 애용 할 꺼 같아요. 아주 좋아요","5"
"75243579","3920147","2025-06-12","성숙한청록플라워","저렴하게ㅈ구입해서 만족해요.
향이 너무좋아요.
오래 지속되구요","5"
"75214412","3920147","2025-06-11","훌륭한대만골프공","제가 좋아하는 향수라 받자마자 기분이 너무좋아졌어요","5"
"75168251","3920147","2025-06-10","단조로운빨강엣지","고급스럽구 병도 짱예뿐데 미니어처는 뿌리는 펌푸가 없어서 어떻게 뿌리는 건지 모르겠어요ㅜㅜ 향은 짱조아요","5"
"75099977","3920147","2025-06-08","까칠곰탱","풀향과꽃향이  아주 조화롭게 섞여있는 향입니다
잔향도 꽤 오래 지속되어 데일리로 사용하기 딱 좋아요
케이스도 고급스럽고 미니어처도 넘 귀엽네요","5"
"75019597","3920147","2025-06-05","거대한홍대핀턱","사은품 먼저 사용해보고 향이 엄청 좋았어요~ 
전날 주문하고 다음날 바로 도착했네요~","5"
"75011031","3920147","2025-06-05","수줍은도쿄출근룩","샘플 너무 귀여워여ㅡㅜ 향이 너무 좋아서 주변에서 물어봐요 추천합니다","5"
"74908466","3920147","2025-06-02","게으른베를린치마","디자인도 예쁘고 향도 조아요 배송도 빨랐고요 생각보다 사이즈도 컸어여","5"
"74883006","3920147","2025-06-01","발랄한몰디브크롭","엄마한테 선물드렸는데 너무 좋아하세요. 오래맡았을 때 속쓰린 그런거 별로 없고 진짜 달달한 여자사람한테 날 법한.. 그런냄새. 20대한테도 잘 어울리고(나) 50대한테도 잘 어울려요(엄마) 추천.","5"
"74871091","3920147","2025-06-01","올바른영국바지","여름에 사용하기 정말 딱인 향수에요ㅠ
디자인도 너무 이쁩니다","5"
"74844523","3920147","2025-05-31",":::☆彡","향 시향도 안 해보고 구매했는데 넘 만족해요 향에 민감하지 않은 편이라!","5"
"74811217","3920147","2025-05-30","기민한토렌토정장","예전에 쓰던거라 가격이 좋아서 구매했는데 여름에 쓰기 좋은 향이에요 잘쓰고있어요","5"
"74803675","3920147","2025-05-30","인예인","냄새가 일단 너무 달지않으면서 머리안아프고 계속맡을정도에요 조금 빨리 날아가는거같기도해요","5"
"74786752","3920147","2025-05-30","neima","제가 최고로 애정하는 향수 중 하나가 됐어요 향이 좀 시원하면서도 러블리한 향인데 우아한 느낌이 강한 게 있어요 그래서 너무 좋아요 매혹적이다?이런 느낌인데 정확히 무슨 향인지는 모르겠고 좀 진한 꽃향기 같은 느낌","5"
"74720540","3920147","2025-05-28","요롤리휘","향 너무 좋고 배송도 빠르고 포장도 깔끔하게 잘되서 와서 너무 좋아요","4"
"74680811","3920147","2025-05-27","띵구훗","여름에 쓰기 좋은 향수라고 하는데 저는 딱히 그런거 모르겠네요..! 하지만 향은 좋아용 쌀짝 꽃 냄새 은은한 장미쪽 그런 향기 싫으면 참고하새용","4"
"74664558","3920147","2025-05-26","햅삐햅비","할인하길래 사봣는데 여성형+ 플라워 향기 가나서 너무좋네요!! 
지속력도 몇시간 감니당~~ 다음에도 사겟슴둥 🌸","5"
"74436743","3920147","2025-05-20","gold덩어리","향수 저렴하게 너무 잘 샀어요 냄새도 넘좋아요 50미리도 사고싶네요","5"
"74424247","3920147","2025-05-20","167816","올리브영에서 맡아보구 좋아서 구매했는데 
향도 좋고 케이스도 예뻐요","5"
"74379948","3920147","2025-05-19","진주크라켄총잽이","엄마한테 선물로 드렸는데 마음에 들어하세요. 향기도 좋고 가끔 저도 뿌립니다 ㅎㅎ 여름 향수로 딱이에요!!","5"
"74369096","3920147","2025-05-19","고명한광주세트","친구 생일선물겸 화이트데이날 선물했는데 너무 만족하네요","5"
"74327293","3920147","2025-05-18","하나가원하람맘","쓰던향수만쓰다가 리뷰보고 구입했습니다
향도 좋고 오래가고 너무 좋아요","5"
"74008108","3920147","2025-05-09","보글짝","올영에서 냄새 맡아보고 반했는데 너무 달달하지 않고 프루티하면서 향긋해요오오 냄새 너무 좋음","4"
"73999379","3920147","2025-05-09","알찬옐로우레트로","사랑스러운 향^^
향도 병두  뚜겅도  러블리
유지력두  잔향도  괜찮아요
재구매  의사  100퍼 ^^
보기만해두  미소지어지는  브라이트크리스탈EDT","5"
"73967688","3920147","2025-05-08","합리적인분홍엣지","뿌리고 느껴지는 첫향이 알코올 냄세가 나요
꽃향도 아니고 그냥 그래요
케이스 만 이쁨","2"
"73909718","3920147","2025-05-07","훌륭한독일양복","향도 좋고 디자인도 예쁜것같아요 베르사체 향수 좋어요","5"
"73841297","3920147","2025-05-04","쇼타마스터","세일중이길래 사봤는데 진짜 너무 사길 잘한것같아요ㅠㅠ
향이 싱싱한 꽃향인데 살짝 상쾌하기도해서 5~9월까지 잘 쓸것같아요!!!","5"
"73829698","3920147","2025-05-04","민첩한칠레프레피","향수 원래 안쓰는 사람인데.. 기분 전환할 겸 후기랑 가격보고 주문했어요~ 향도 너무 진하지 않아서 좋습니다~","5"
"73567639","3920147","2025-04-27","롬앤녀","올영에서 시향해보고 반해서 바로 샀어요 ㅠㅠ ㅋㅋ 베르사체 치고 가격도 괜찮고 지속도 오래 갑니당 친구들이 어울린대서 만족중이에요 다 쓰면 또 살 듯!!","5"
"73397355","3920147","2025-04-22","희귀한안목","이렇게 싸고 향도 좋은데 좋은브랜드 향수 이거말고 더 있나요? 마치 한송이의 장미가 하나 된 기분입니다 1년동안 향수 하나만 파는데 1년동안 잘 부탁드릴려고요","5"
"73307532","3920147","2025-04-19","o0o0o3","친구 생일선물로 사줬는데 넘 좋아했어요 근데 저도 사야겠어요 
생각했던것보다 넘 좋아여 안 흔한 여리여리한 향🫶🫶","5"
"73267722","3920147","2025-04-18","쿵사자","어디서맡아본향이애여요
매우조음
엄마선물로삿어요","5"
"73190470","3920147","2025-04-16","댄디한서울코디템","미니 향수 너무 귀여움..🫰🫰 향은 그냥 달달하고 딱히 호불호 없을듯한 향.  봄-여름에 뿌리기 좋을듯!","4"
"73107367","3920147","2025-04-13","Eillina3","향수향이 너무 좋아 💕💕💕
1번만 쓰고 하루동안 향이 있어","5"
"77419652","3146377","2025-08-05","명이명이2","시향안해보고 그냥 샀는데 생각보다 굉장히 달달한 향
복숭아? 자두? 약간 플럼향이 강함
여름보다는 가을겨울에 좀 시원할때 쓰면 좋을듯하네요","5"
"77402886","3146377","2025-08-04","헤이곰","금목서향을 안맡아봐서 잘 모르겠는데 복숭아향이에요!!","4"
"77384935","3146377","2025-08-03","구왁우왁","향 자체가 호불호 없이 쓰기 좋은 향입니다 자주 뿌릴 듯 해요","5"
"77383441","3146377","2025-08-03","힙한호랑이","향도 달콤하고 여름에 레이어드 하기 좋아요 재구매 의사","5"
"77364854","3146377","2025-08-03","우리우찌","살면서 이렇게 별로인 향수는 처음임. 싸구려향.. 올영에서 세일하는 몇천원짜리 섬유탈취제가 훨씬 향긋함. 유투브에서 비비가 길가는사람 붙잡고 물어본 향수라고그래서 뭐에 홀린듯 바로 주문한건데 광고에 제대로 속음 ㅋㅋ
옷에라도 뿌려야지 싶었지만 그것도 불가.. 걍 다 버림","1"
"77338171","3146377","2025-08-02","강력한부산앞치마","올영에도 싹다품절이고 인기템이니까 다들 무신사에서 사세용
냄새가너무좋아요 쟁여템입니다","5"
"77336214","3146377","2025-08-02","현태왕자","항상 좋은 상품 많이 부탁드리며,
빠른 배송 감사합니다.","5"
"77325356","3146377","2025-08-01","밝은브라운캐주얼","첨엔 복숭아 냄새 밖에 안났는데 좀 더 뿌리고 다녀보니 꽃향기도 좀 나는 거 같어요 고급진 복숭아향수같슴다","5"
"77300732","3146377","2025-07-31","ㅎ현듀","향 너무 좋아요 다른 향도 구매하고 싶습니다~한 손에 딱 들어와서 들고다니기 좋아요","5"
"77284803","3146377","2025-07-31","쿵따쿵","댓글에 싸구려 복숭아향이라길래 뭔가 했더니 뿌리자마자 뭔지알겠어서 웃겼어요ㅎ 
그래도 가격 저렴하고 뒤에는 살짝 꽃향 올라와서 차에다 놓고 막쓰기 좋음","4"
"77282971","3146377","2025-07-31","yooouun","금목서향이라기보단 복숭아향 같은?̊̈ ?̊̈  지속력은 생각보다 길어요 달달한 복숭아향이어서 여름에 쓰기 좋아요","5"
"77273230","3146377","2025-07-30","왕귤빵","향은 좋은데 복숭아향이 확실히 더 강한거 같아요 ㅎㅎ","4"
"77262105","3146377","2025-07-30","대담한서울숲미니","향기는 쏘쏘합니다~ 지속력은 괜찮은 것 같아요 여름","3"
"77256712","3146377","2025-07-30","흔한대만아이참","쪼꼼 더운향이긴한데 비비가 좋아하는 향수라 사봤어요~
가성비 괜찮아요~","4"
"77214064","3146377","2025-07-28","낮보단밤","복숭아 향이 은은해서 좋긴한데 확실히 향이 금방 사라지는거 같습니다","4"
"77213395","3146377","2025-07-28","사랑스럽지만시크","가성비 좋아요 막 뿌리기 좋은 향입니다!!
가을 겨울까지 막 쓸 수 있을 것 같아요","5"
"77205791","3146377","2025-07-28","최22","향이 부담없고 잔향도 좋아서 자주뿌리기 좋습니다","5"
"77200881","3146377","2025-07-28","챔이콩","향수 유튜브 광고 보고 샀는데
정말 싼티나고 별론데요...
방향제같은 그리고 풍성한향이 안느껴지고
어지러운 이상한 별로..맡아보고사세용..","1"
"77169802","3146377","2025-07-27","흥미로운서울비니","예상하던 향이랑은 좀 거리가 있지만 여름에 사용하기 좋을 것 같아요!","4"
"77144668","3146377","2025-07-26","밥잡밪","달달구리냄새젛아요 여자향수로어울려요 감사합니다","5"
"77128512","3146377","2025-07-25","뻔뻔한핑크단화","꽃향과 복숭아향과 싱그러운 풀잎 냄새에요
안좋아 할 수가 없음!!!","5"
"77126983","3146377","2025-07-25","감자깡리","비비님이 향따한 향이래서 따라사봤어용
저는 금목서향을 몰라서 지인들한테 맡아보게 하니까
맡자마자 금목서향이라고 알더라구요!!
제가 맡은 느낌으로는
은은한 샴푸향+복숭아 아이스티향 느낌이에요.
향수 싫어하는 사람도 별로 거부감이 없어하더라구용
부담없이 뿌릴 수 있을 거 같아서 잘산것 같습니다!","5"
"77108425","3146377","2025-07-24","RA123","제품이 너무 좋습니다ㅎ
다음에도 구매해 잘 사용하겠습니다. 
선물용으로도 너무 좋습니다!!!!! 
이제는 제가 구매해서 사용하겠습니다^___^","5"
"77105253","3146377","2025-07-24","안냐세요뚱이에오","금목서 향이 뭔지는 잘 모르지만 향 좋다고 하길래 일단 사봤어용 복숭아 향을 좋아해서 그런지 첫 향은 조금 낯선데 잔향이 마음에 들어요!","4"
"77103062","3146377","2025-07-24","화나는대구벨라인","한번도 맡아본 적 없는 오묘하고 매력적인 향이라 마음에 들어요. 뭔가 조금 달콤하면서도 인위적이면서도 자연향 같은 느낌. 은은하게 매력있어요.","5"
"77089737","3146377","2025-07-24","애국애족","제가 딱 찾고있던 향입니다. 여름이랑 너무 찰떡이에요 ! 병도 너무 이쁘네요 ㅎ","5"
