"review_no","product_id","createDate","userNickName","content","grade"
"73913222","3354150","2025-05-07","리차드","소량만 사용했는데도 지속력이 매우 좋아서 저녁 때까지 유지가 되었고 항 자체가 클래식해서 어느 코디에도 사용하기가 좋았습니다.","5"
"73811048","3354150","2025-05-04","딸기에몽개맛","처음 향은 강해서 별로 였는데 주변 평이 좋고 잔향이 더 맘에 드네요 만족합니다","4"
"73702028","3354150","2025-04-30","LJ협","향 좋습니다 ㅎㅎ 최고에요 병도 너무 예쁘게 생겼네요","5"
"73682813","3354150","2025-04-30","koloc_koloc_","그저 고트 . 일하다가 만난 사람들도 가끔 향을 물어보고 개인적이지만 지속력이 나쁘다는 생각은 한번도 안해봤습니다 좋아요","5"
"73627319","3354150","2025-04-28","삥잉앙","친구에게 선물한건데 오래전부터 갖고 싶어헸던거라서
엄청 좋아하더라고용 ㅋㅋ
향이 백화점 가면 나는 향이라고 설명을 하는데
전 아직 직접적으로 맡아본적이 없어서어…
우선 사진으로만 봐도 병이 특이하게 생겨서 이쁘고
색깔이 진짜 맘에 들게 생겼어용","5"
"73622530","3354150","2025-04-28","진주눈","일단 여름에쓰기좋은향이네요 지속력은오래개못하네요","4"
"73564045","3354150","2025-04-26","근사한밀라노모던","베르사체 향수를 이 가격에 구매할 수 있어서 좋습니다
냄새도 여름에 어울려요","4"
"73540898","3354150","2025-04-26","온화한대치동단화","블루가 맘에들어 추가하여 여자제품도 구매합니다  좋네요","5"
"73537562","3354150","2025-04-26","aalmond","블라인드 구매한 블로그 후기 많이 뒤져보고 샀는데 생각만큼 좋진 않아요 ~ 설명하곤 다른 느낌이에여","5"
"73506025","3354150","2025-04-25","애틋한삿포로새틴","첫 향이 좀 쎄긴하지만, 잔향이 좋습니다. 향은 상큼한 느낌일줄 알았는데, 달콤한 느낌이 더 나네요.","4"
"73415820","3354150","2025-04-22","유니62","혹시 정품은 맞나요 옛기분 느끼고 싶어 사기는 했는데  쎈 알콜향이 진합니다","2"
"73367154","3354150","2025-04-21","용산핵간지","이걸로 여자 5명 꼬셨다
아임어킹카
향이 산뜻하고 좋아요","5"
"73361808","3354150","2025-04-21","야또.","시원하고 상쾌한 향이라 여름에 잘 어울립니다.
데일리로 쓰기 좋아요.","5"
"73284571","3354150","2025-04-18","0001111","향도 향이지만 패키지가 너무 예뻐요 친구 생일선물로 구매했는데 친구도 엄청 만족해하고 사용중이라고 합니다","5"
"73236232","3354150","2025-04-17","희망찬아테네래플","향이 어른의 여름향이네요
부드러운수컷의냄새!!!!","5"
"73210509","3354150","2025-04-16","오수와","오래전에 사용했던 제품...다시한번 사용하고싶은..
좋아요!!!","5"
"73147615","3354150","2025-04-14","웅장한청색숄더백","완벽한 향수
두번째구매사용중입니다.
한번쯤은 꼭 구매해보세요","5"
"73136787","3354150","2025-04-14","차먐","병이 독특해서 인테리어 소품으로 좋을 것 같아요. 지속력은 그렇게 좋은 편은 아닌 것 같습니다.","4"
"73052352","3354150","2025-04-12","김범준7","일단 향이 확실히 오래 가는거 같습니다. 낮에 뿌리고 스카갔다가 밤에 왔는데도 잔향이 계속 남아있어요. 뿌리고 한 10분정도 있으면 향이 너무 쎄지거 않고 딱 적당해지는 것 같습니다. 양도 많아보이고 좋네요.","4"
"72925513","3354150","2025-04-08","Nikki21","너무 남성적이지도 않으면서 은은한 향이 대게 매력적인거 같아요  향 지속력도 너무 좋고 완전 꿀템 ㅋ","5"
"72892504","3354150","2025-04-07","냉곰","한달이상 사용중인데 아주 좋습니다
망설이지 말고 구매하세요","5"
"72873297","3354150","2025-04-06","스트릿파이터.","처음 써보는 향인데 좋아요 무난하고 평소에 뿌리고 다닙니다","5"
"72806562","3354150","2025-04-04","거친남색테일러드","그냥 사봤음 내스타일은 아니네요
독함 ㅜ  그래도 모으는 재미","3"
"72771961","3354150","2025-04-03","crash2","향이 아저씨 로션향인데..잔향이 제법 좋음!!
아무래도 가격이 저렴하니 지속력이 짦아서 아쉬움~","4"
"72746592","3354150","2025-04-03","전-호","향이좋아서
하나더 구매합니다.
무게감은 살짝있고 단향이 나요~","5"
"72683807","3354150","2025-04-01","won7000","남자향기 너무좋음 근데 머리살짝아픈데 좋은향임","4"
"72680918","3354150","2025-04-01","소삼돌이","여름에 쓸 향수 필요했는데 묵직하지 않은 향이라서 자주 사용 할 듯 합니다","5"
"72622531","3354150","2025-03-30","유연한헬싱키티켓","선물로 줬는데 향도 좋고 케이스가 예뻐서 좋은거 같아요","5"
"72567716","3354150","2025-03-28","BlueCore","계절을 많이 타는 향수는 아닌데 겨울에 쓰면 살짝 차가워
보일 수 있는 시원한 느낌의 향수라고 느꼈어요.
첫향은 스킨냄새 인데 점점 스킨향이 날라가면서 조금은
달달하고 부드러운 머스크향과 살짝열매향이나고요 바닐라와 우드향이 끝에 남아요. 성별 안타고 쓸 수 있는 향이예요.
저는 중성적인 향을 좋아해서 자주 뿌려요.
향 지속력은 너무 약하지도 세지도 않아서 은은하게 남고요
3번이상 뿌리면 좀 진하게 느껴져요.","4"
"72442224","3354150","2025-03-24","곽철성","아버지 선물로 사드렸는데 잘 쓰고 계신것 같아요 향이 좀 쎈 향수랍니다","5"
"72369751","3354150","2025-03-22","너그러운부산패턴","배송 빠르구요 베르사체 향이 좋다고 하네요
만족입니다","5"
"72363675","3354150","2025-03-22","랩이좋은뉴욕심플","이 향수 너무 좋아요. 남자한테 너무 좋은 향이에요😍 빈티지한 룩이 더 좋아지게 만들어요.","5"
"72348752","3354150","2025-03-21","룻득","아는형이 향이 좋다고 히니서 선물 줬어요 가격도 부담 없어서 좋았습니다. 형도 만족해 하는거 같아 좋네요 여름에 써도 괜찮아 보여요","5"
"72244160","3354150","2025-03-18","gogomoo","20다 사용하던 향수 라서 구매해 봤습니다.
은은하면서 시원한 향이 맘에 듭니다.","5"
"72183583","3354150","2025-03-17","미키찰스","배송도 빠르고 향이 너무좋네요 매일쓰고있답니다","5"
"61426879","3348915","2024-06-27","cocovolt","여름에 데일리로 오랜만에 다시 구매했네요 좋아요","5"
"61383865","3348915","2024-06-27","롤하기싫다진짜","향이 기존 스프레이보다 쎄고 지속력도 오래가는거같아요!","5"
"61037853","3348915","2024-06-21","맞자나","생각했던 향보다 너무진해요
ㅜㅜ시향해볼껄 후회합니다","2"
"60931815","3348915","2024-06-18","발끝충무신사","좋습니다 향좋고 오래가고 최고오
만족합니다아","5"
"60830783","3348915","2024-06-15","Bov8_8","러쉬 매장 가면 나는 냄새 그 자체 입니다 
더티향 좋아하는데 향수로 나와서 넘 좋네요","5"
"60741990","3348915","2024-06-13","하우리96","작성하신 후기는 무신사 및 무신사 글로벌 이용자에게 공개됩니다. 댓글은 무신사에서 확인하지 않습니다.
일반 후기 작성 시 500원의 적립금을 평일 기준 2일 전후로 지급합니다.
아래에 해당할 경우 적립금 지급이 보류되며, 이미 지급받으셨더라도 2차 검수를 통해 적립금을 회수할 수 있습니다 ,또한 일부 후기는 조건에 따라 비노출 처리 됩니다.
- 문자 및 기호의 단순 나열, 반복된 내용의 후기
- 주문하신 상품과 관련 없는 내용의 후기
- 개인정보 및 광고, 비속어가 포함된 내용의 후기
원활한 서비스 이용을 위해 후기 도용 시 적립금 2배 회수, 3개월간 후기 적립금 지급이 중단되며, 일부 무신사 서비스 이용에 제한이 발생될 수 있습니다.","5"
"59192454","3348915","2024-05-10","둔감한송파반지","좋아요 생각했던거랑 같아요 만족해용 재구매입니다","5"
"58246995","3348915","2024-04-20","신중한피사터틀넥","러쉬 더티 너무 좋아요 ! 데이트 있는 날 뿐만 아니라 이젠 매일 출근길 전에 뿌리고 나갑니다 ㅎㅎ","5"
"55423211","3348915","2024-02-11","비니랑이","향이 무난하고 여름에 잘 어울릴 거 같은 향이에요","5"
"54698501","3348915","2024-01-22","mumuuum","동생 생일 선물로 삿더요
스프레이도 너무 잘쓰고 있는데 더 지속력 강한 퍼퓸으로 사봤아요
소량으로도 향이 쎄서 젛고 오래가요 
다음엔 다른향으로 또 사보랴구요 
만족하는 퍼퓸입니다아 추천띠","4"
"54673228","3348915","2024-01-21","은행나무냄새","바디 스프레이 뿌리고 나서 향이 좋아서 향수 사봤는데 향수가 더 향이 좋은 것 같네요","5"
"51635837","3348915","2023-11-24","yitaehi","애착 향 입니다! 오랫동안 사용해도 질리지가 않아요! 아주 만족합니다!","5"
"50417489","3348915","2023-10-30","iibnad","더티 향을 워낙 좋아해서 샀는데 역시는 역시네요
최고입니다 다 쓰면 또 사서 쓸거에요
매력적인 향 👍🏻","5"
"50304297","3348915","2023-10-27","구름을","첫향이 스피아민트 향이라 상쾌하고 잔향이 은은하게 지속되어 상쾌한 느낌을 오래 가져가 좋았습니다.","5"
"49156596","3348915","2023-10-05","사운드오브썬","더티 강강추추드려요!
러쉬 덕후인데 더티는 샤워젤만 쓰다가 드디어 향수를 장만했어요 민트향에 포근한 코튼향이 더해져서 시원하지만 따뜻한 느낌이에요 팬지 로즈잼 등 기존 플로럴 향수랑 레이어드 해도 향이 너무 좋아서 활용도도 높고, 더티 단독사용이 부담스러우신 분들은 이렇게 사용해보셔도 좋을 것 같아요! 더 빨리 구매할 걸 그랬어요! 만족도 391737% 향 지속력은 의외로 길지 않아요 오히려 팬지 이런 애들이 엄청 오래가요

다만 러쉬 향수의 문제점인 뚜껑이 헐겁다는게 아쉬워요ㅠㅠ 포장은 환경 생각하는 러쉬답게 빠르고 안전하고 친환경적으로 와서 좋았습니다 배송 온 뿡실이들?은 세면대에 물 받아서 냅다 다 때려박았는데 아주 잘 녹았습니다

러쉬는 항상 오프라인에서만 사다가 첫 온라인 구매를 무신사에서 하게 됐는데 적립금도 쓸 수 있고 좋아요! 팩 사은품도 오고 무엇보다 첫 온라인 구매에 운이 좋게 랜카를 받게 되었는데 무려 4만원 상당의 로즈잼 미니 바디스프레이!! 앞으로도 온라인 구매 애용하겠습니다ㅎㅎ

+ 향수 뷰티 리뷰에 상반신 샷을 올리는게 독특하네요 평소에 스트릿 단정 페미닌 다양하게 입는 편인데 러블리페미닌을 제외하면 다 잘 어울리는 향이에요","5"
"48762898","3348915","2023-09-25","\•_•|","호불호 가는 향이지만 저한텐 완전 호입니다
여름에 잘 뿌리고 다녔어요","5"
"48344706","3348915","2023-09-14","주희희히히","생각보다 작은데 꽤 오래쓰고있습니당 향도 좋아요 지속력은 그렇게 오래가진 않는거 같은데 잔향이 매력있어요 ","3"
"47947378","3348915","2023-09-04","jjjong_h","여름에 땀이 많이 나서 다른 향수들은 향이 약간 변하고 지속력이 짧아지는거 같은데 더티는 그런거 하나 없이 오래 유지됩니다!! 여름에 쓰기 진짜 좋은 향수!!","5"
"47834936","3348915","2023-09-01","민긍쏭","항상 쓰던 제품인데 할인해서 잘 샀어요
또 구매할게요","5"
"47815904","3348915","2023-08-31","일단구매진행해","러쉬 진짜 좋아하는데 드디어 무신사에서도 구매 가능하다닝 ..!.!!!!!! 당장 고민도 안하고 더티 질러버렸습니다 💦
향 완전 여름 ~~~!!!!! ( 지나가고 있능 것 같지만 ,,, )
그래두 제 최애 향 중 하나라구욧 !! ","5"
"47379202","3348915","2023-08-21","은파앙","유명하길래 사봤는데
제 취향은 아니라 아쉅네요..
화장품 냄새 같기도 하고..","5"
"47352815","3348915","2023-08-20","Imhoya","향이 평소에 맡는 향수들이랑 달라서 차별성있고,
향도 좋아요!!","5"
"46548888","3348915","2023-07-28","dn159357","터티 바디스프레이 써보고 향이 너무좋아서 향수도 구매~","5"
"46263743","3348915","2023-07-21","효율적인로마단화","배송빠르고 향은 말해뭐해 너무 좋아요!! 완전 여름향수","5"
"45645204","3348915","2023-07-06","7근1 감시제한","향이 좋아서 늘 구매하고 싶었는데 이제야 샀네요.","5"
"45552789","3348915","2023-07-04","프랭크34","여름에쓰기 좋아요 약간 치약향이고 잔향이 좋아요","5"
"45176623","3348915","2023-06-28","핑크아빠요","진짜 가성비 너무 좋고 데일리로 사용하기 딱이에요 추천합니다!","5"
"74434121","3662677","2025-05-20","보수적인피사패턴","향이 일단 너무 좋네요 가성비최고에요 지속성도 길고 좋아요","5"
"74017855","3662677","2025-05-10","cocoria","향도 무겁지 않고 나름 오래 지속됩니다. 케이스도 예쁘고 맘에 듭니다.","5"
"73482199","3662677","2025-04-24","우아한베이지크롭","덱스향수로 유명하더라구요.오브제 브랜드가 
남성화장품중에 유명한것 같아서 선물하려고 
주문했어요. 
남편이 우디향을 좋아하는데, 
재즈머스크향은 묵직한 우디향과 시간이 
지날수록 올라오는 달콤한듯한 향이 너무 좋네요.
남편도 향이 너무 좋다고,  향도 오래유지되고 
너무 맘에드는 선물이라고 합니다.","5"
"73445859","3662677","2025-04-23","조뚜용","오브제 화장품을 자주 애용하는데 퍼품까지도 향이 지리네요","5"
"73371654","3662677","2025-04-21","독보적인북촌팬츠","오! 엄청 멋있어요!! 파란색 글라스가 엄청 고급스러워보이고 상남자의 그 향기가 느껴집니다! 곧 기념일 다 되서 선물 주려고 샀는데 넘 좋아할 것 같아요! 와~~~! 코르크 마개도 마음에 들고 이제 편지랑 이쁜 상자하나 준비해서 선물 주면 될 것 같네요! 굉장히 마음에 듭니다~!","5"
"73358418","3662677","2025-04-20","포근한서촌쇼핑몰","예전에 쓰다가 향이 너무 좋아서 재구매했는데, 이번에 보니까 용기가 살짝 리뉴얼된 것 같더라구요? 좀 더 세련되고 감각적인 느낌이라 마음에 드네요 ㅋㅋ 은은한 향이라 좋아요! 데일리로 쓰기 딱 좋은 향이라 앞으로도 꾸준히 사용할 것 같아요","5"
"73206030","3662677","2025-04-16","Nxxbyc","만족합니다 ~ 잘 사용할게여 
첨에 배송온 상태 보고 깜짝 놀랐습니다 ㅎ
안경집에 뭐 여러가지 .. 포장 상태 완벽합니다","5"
"73104494","3662677","2025-04-13","짱캣","전남친 생일선물로 줄랴고 샀는데 차였어요
제가 향수는 실패한적 없거든요 제가산거니까 당연히 향 좋겠죠","5"
"72915798","3662677","2025-04-08","천명훈","두번째 구매 사용중입니다 향좋고 은은하게 오래 갑니다
추천추천","5"
"72834662","3662677","2025-04-05","....!!!!","향이 너무 고급스럽고 주위에서도 다 좋아해요 가성비도 너무 좋아요","5"
"72833649","3662677","2025-04-05","kikoku","체험단으로 만났던 제품인데 
너무 마음에 들어서 다시 재구매 합니다. 
주뱐 피드백이 정말 좋았던 제품이고 
부향률도 준수하고 데일리로 부담없이 
사용하기에 정말 좋습니다! 
머스크를 좋아하신다면 강력 추천드립니다.","5"
"72789511","3662677","2025-04-04","미묘한종로미니","향이 궁금해서 사봤는데 당분간은 잘 사용할거 같아요!! 너무 만족 합니다!","5"
"72438233","3662677","2025-03-24","투명한노랑치마","정말 향이 다네요.. 요즘 제일 많이 쓰는 향수입니다.,","5"
"72386667","3662677","2025-03-23","얄미운인천쇼핑몰","카폐나 식당가 같은데 갈 때 뿌려요. 학교 갈 때 뿌리는건 좀 부담있는 느낌.","4"
"72248369","3662677","2025-03-18","마틸다레옹","향둏아요 무거운듯가벼운 데일리로쓰네ㅣ요 만족","5"
"72222859","3662677","2025-03-18","오아타라","베르가못 샀다가 맘에 들어서 바로 재즈 질렀어요","5"
"72125189","3662677","2025-03-15","삐약이아빠","첨엔 걍 좋아서 샀는데 마르지엘라 재즈클럽이랑 향이 비슷하다는 얘기 들어서 더좋아요","5"
"71874425","3662677","2025-03-08","rjsdnd522","생각보다 지속력이 좋은 것 같습니다. 처음에는 향이 좀 쎈 편인것 같은데 시간이 지나면서 은은하게 바뀌어 가는 것 같습니다.
향이 좋아요 오히려 시간이 지나먼서 향이 더 좋아지는 거 같습니다  . 앞으로도 잘 사용할게오! ㅎㅎ","5"
"71802168","3662677","2025-03-06","예민한나고야집업","포장 상태도 좋고, 배송도 무척 빠릅니다. 향기도 좋습니다.","5"
"71476144","3662677","2025-02-24","yseo_21","첫 향에 진한느낌은 정말 금방 사라지고
잔향은 아주 오래갑니다.","5"
"71403137","3662677","2025-02-21","sarahae","시원힌거 같지만 가볍지 않고 무거운 향! 오브제 향수는 향이 다 좋은듯합니다! 요즘 오브제 향수만 돌려가면서 쓰고 있어요","5"
"71374985","3662677","2025-02-21","겸둥초코","나름 향수셀렉터인데 향이 굉장히 독특하고ㅜ매혹적이네요..저누머스크보단 약간 코코아향을 마니 느꼈어요
겨울향수 강추","5"
"71258275","3662677","2025-02-17","Ian k","저렴한 가격에
데일리로 부담없이 사용 가능해요.","5"
"71238272","3662677","2025-02-17","기민한노랑슬리퍼","향이 오래 남아서 좋고,향이 쌔지 않아서 누구나 사용하기 좋은거 같아요","5"
"71119566","3662677","2025-02-13","충실한청담카고","머스크향이 진한데 시간이 지나면서 달콤하고 부드러운 잔향이 남습니다 지속력 좋습니다 전 마음에 드는 향수에요","5"
"71058723","3662677","2025-02-11","주녘이","머스크향 처음사봤는데 입문하기 좋네요 겨울에딱","4"
"70982036","3662677","2025-02-09","스지녕","가격 대비 너무 좋네요
잘 쓰고 있습니다 추천해요","5"
"70925337","3662677","2025-02-08","MHungu","향이 오래가고 지인분들도 향이좋다고하네요 굿","5"
"70894097","3662677","2025-02-07","진실한대전도트","향이 진짜너무좋다 라고 사람들도 다 말할정도로 제가 느껴도 좋은향이네여","5"
"70845757","3662677","2025-02-06","응성잉엥용","향이 시원하고 상쾌해요 남자친구한테 선물했더니 너무 좋아해요","4"
"70812410","3662677","2025-02-05","창스타여","향기 품질 어디하나 안빠지네요 하나더 사서 계속쓰고싶어요","5"
"70800464","3662677","2025-02-05","Mushroom486","향이 조금 지속력이 떨어 지네요 반나절이 안감
그래도 향이 따뜻하고 좋아요","5"
"70732632","3662677","2025-02-04","지루한노랑주얼리","이름이 마음에 들어서 구매했어요 보틀이 맑습니다","4"
"70635495","3662677","2025-02-02","독특한대만민소매","겨울에 뿌리기 좋은 향수 같아요 데일리로 뿌립니다","4"
"70601657","3662677","2025-02-01","젠틀한크림색수트","잔향이 오래가고 향이 좋습니다!
매일 출근할때 뿌리고 다닙니다 ㅎㅎ","5"
"70572117","3662677","2025-02-01","장마엔이태리옷장","남편에게 선물했는데 출근할때마다 뿌리고 다녀요.향이 세련되고 좋아요","5"
"70290138","3662677","2025-01-22","명백한스웨덴스틸","냄새가 오묘하니 생각보다 나쁘지 않네요. 잘 써보겠습니다","4"
"70245317","3662677","2025-01-21","겨울의바람","겨울철에 사용할 향수로 적당하네요. 머스크향이 진해서 취향을 타긴합니다만, 이정도면 훌륭합니다. 퍼퓸이라 향이 오래가는것도 좋아요","3"
"70245063","3662677","2025-01-21","가오가이거가오","배송도 빠르고 향도 저와 맞고 좋아요 추천합니당","5"
"70031520","3662677","2025-01-15","상큼한합정디자인","향기가 너무 좋아요 제 스타일입니다!! 모두 사용해보세요~","5"
"69809840","3662677","2025-01-09","낭만의중년","냄새가독특하지만
아주오래가요.첨에는. 톡쏘는냄새지만
지날수록좋아요","5"
"69727408","3662677","2025-01-07","팍팍한라임옷장","향이 생각했던거 보다 더 좋게 나요 진짜 추천 다쓰면 재구매 함","5"
"69661880","3662677","2025-01-05","소나무22222","세일기간에 엄청 저렴하게 구매했네요.
향이 좋아서 요즘 이거만 써요~","5"
"69648560","3662677","2025-01-05","LA이렇게CHA","달달한 바닐라같은 향이 나요! 편하게 뿌리기 좋은 것 같아요","5"
"69578973","3662677","2025-01-03","gentlehands","바디샆 화이트머스크랑 비슷할 줄 알고 샀는데 ㅎㅎ
화장실한테 양보했네요 ㅎㅎ

달달한머스크향이라 30대 이상 여자분들에게 적합한 
남자한테 달달한 냄새나면 아주 별로조 ㅎㅎ","3"
"69565432","3662677","2025-01-03","성숙한런던후드티","냄새. 남자남자 마음에들어요 대박 꼭 한번 구매해보세요","5"
"69513432","3662677","2025-01-01","싸이로","어디서  많이 맡아본 향이다 했는데 
파코라반 원밀리언 이랑  완전 똑같네요","3"
"69444386","3662677","2024-12-30","jodanK","오브제는 믿고구매하는데,
향수는 처음이라 고민하다가
평보고 주문했는데, 제가 생각한 향이랑 조금다르지만
이뻐요","5"
"69337329","3662677","2024-12-26","프로다운용산쿨톤","향기가너무좋아요^^
오래가고요~남친선물했는데 너무 좋아하네요
담에또 구매할것같아요~~","5"
"69290062","3662677","2024-12-25","우수한여의도향수","향이 목욕탕 냄새처럼 좋아용
공병이 이뻐용
추천합니당~~~~~","5"
"69224501","3662677","2024-12-23","부워락비워락","냄새 너무 은은하게 오래가서 데일리로 뿌리기 너무좋아요ㅎㅎ","5"
"69050017","3662677","2024-12-18","날씨가추워으","시원한 향이 나면서 겨울과도 잘 어울린다고 생각해요","5"
"59289647","3365088","2024-05-12","고블리가현","저의 최애 향수입니다. 제 지인들은 이 향은 저라고 기억할 정도에요. 지속력이 길지 않은게 단점이지만 그만큼 좋으니 몇병째 사용중이랍니다","5"
"58325552","3365088","2024-04-22","거대한시애틀부츠","일단 향이 제가 써본 향수 중에 제일 좋아서 재구매 의사 또 있어요 짱","5"
"58078722","3365088","2024-04-17","B04CD","향 좋고 포장도 좋고 다 괜찮아요. 더티향 질리면 시도해보는거 나쁘지 않음.","5"
"58077217","3365088","2024-04-17","권도0","빈티지 옷집에서 날 거 같은 향인 제품이에요 러쉬브랜드와 잘 어울리기도 하고 데일리고 쓰기 좋습니당","5"
"57833054","3365088","2024-04-11","강한옥색시즌오프","랭킹 순위가 높아서 샀는데 향에 후불호가 좀 많이 갈릴 것
같아요 매장가서 맡아보시고 사세요!","4"
"57555120","3365088","2024-04-04","선물하는런던린넨","첫 향수였는데 딱 달달하고 무난한 향 같아요. 평소에 뿌리기 좋은 향 느낌이네요","5"
"52096476","3365088","2023-11-29","바바라보","달달한데 머리 안아픈거 처음봐요 세상에ㅠ 너무 맘에 들어요
향도 좋은데 머리 아픈것도 없어서 애장템 될것같아요","5"
"51716719","3365088","2023-11-25","파랑메리제인","향 지속력 좋고 배송도 빠릅니다 러쉬라서 그런지 믿고 구매합니다","5"
"50523329","3365088","2023-11-01","개빡친개구리","정말 러쉬매장향같고 아로마틱한 향이에요 만족합니다","5"
"49843768","3365088","2023-10-18","72010279","지속시간은 4~5시간 정도입니다
러쉬매장에서 시향했던 냄새라 몇년째 애용하고 있습니당","5"
"49548160","3365088","2023-10-12","하츠네미쿠의소실","너무너무 좋은 향이에요 진짜 취향!! 러쉬 매장냄새 나고 러쉬에 온 기분이에요 근데 지속력은 좀 떨어지는 듯","5"
"48946618","3365088","2023-09-29","so소소","러쉬 매장에서 나는 향이라고 햐서 구입했는데 점 다르지만 좋아요","5"
"48556072","3365088","2023-09-20","잠이많아","가장 러쉬다운 향이 남
청량하면서 프루티한 달콤한 향이 러쉬스러움
지속력은 생각보다 짧음
다 쓰고 백미리 들임예정","5"
"48530943","3365088","2023-09-19","징글벌","고체향수 써보고 좋아서 샀는데 더 지속력도 오래가고 냄새도 너무 좋아요!","5"
"46416679","3365088","2023-07-25","흰둥이._.","진짜 러쉬 들어가면 맡을 수 있는 향이네요 ㅎㅎ 너무 만족합니다~","5"
"45554574","3365088","2023-07-04","홍리몽리","항상 사용하는 향수에요!! 
1년에 한번 주기적으로 꼭 구매하는,,
러쉬는 향이 다 좋아서 작은 사이즈로 여러가지 향 구매해서 사용하기 좋아여","5"
