"review_no","product_id","createDate","userNickName","content","grade"
"77277498","5231016","2025-07-30","얼얼한동대문로브","올영에는 작은게 없어서 무신사에서 샀어요!
향은 좀 시원한 향인데 다른사람들 후기에 비누같다고 하는데 이게 비누향인지는 잘 모르겠어요. 특이하긴 한데 뿌려놓고 살짝 날아가면 향 괜찮아요. 생각보다 진해서 조금씩 자주 뿌리면 좋을 것 같아요.","5"
"77260822","5231016","2025-07-30","빈비니닝","사이즈가 미니라서 휴대성이 좋아요 같이 주는 샘플들도 부담없이 쓰기 좋습니다","5"
"77138110","5231016","2025-07-25","기쁜민트점프수트","샤워하고난후 너무좋아요
계속 생각나는 향입니다 사계절내내쓰기좋을듯요","5"
"77129279","5231016","2025-07-25","무무~","진짜 쪼그매요 ㅋㅋ 치실크기! 휴대용 ㅆㄱㄴ
큰 용량은 부담돼서 못 샀는데 작은 크기로 출시돼서 바로 질렀어요!","5"
"77127937","5231016","2025-07-25","Idisso","향기가 특이하게 좋아요
아직 배송온지 얼마 안돼서 숙성시켜봐야겠지만 비누향 + 약간 톡 쏘는 향이 있어용","5"
"77091821","5231016","2025-07-24","단순한오치드진주","너무예쁘고 향기도좋아요
패키지 취향저격입니다ㅎㅎ또살거에요","5"
"77049291","5231016","2025-07-23","hye-ji-","바디로션이랑 같이 구매했는데 바디로션 바르고 뿌려주면 두배로 행복합니다!","5"
"77036880","5231016","2025-07-22","장마엔크림숄더백","작고귀엽고 향도좋습니당
배송은 거의 쿠팡급으로 왔어요","5"
"76889569","5231016","2025-07-17","리락쿠마줄이면","기존 것은 양이 부담스러워서 구매를 망설였는데, 적은 용량이 나와서 바로 구매했습니다 향 너무 좋아요!","5"
"76829265","5231016","2025-07-15","깔끔한성수코디맵","냄새너무좋아요 향수 하나다 쓰기어려운데 10미리라 딱 쓰기좋은 양에 포장도 좋았습니다~~!! 배송도 빨랐어요!!!
추천추천 올영에서 냄새맡아보고 너무 향이 강하게남아서
큰거사려다가 다못쓸거같아서 10미리잇길래 구매했는데 넘좋💓","5"
"54377930","4902824","2024-01-13","포키네나라","향 좋아용 포근하고 달달한향입니다! 처음 배송왔을때 용기 불량이였어요","5"
"53680971","4902824","2023-12-26","7ㅣ염둥이","연한 향은 아니지만 포근한 느낌의 향이에요
무난하게 뿌리긴 좋아요","4"
"52763536","4902824","2023-12-07","화사한동묘의상","향이 은은하고 좋고 향기도 오래가서 한 번 뿌리고 나가면 5~7시간은 향이남","5"
"52561235","4902824","2023-12-04","뉴비_언7d7c7357ae7","기존 샤* 향수를 사용해왔는데 메모리향이랑 거의 비슷하네요. 50ml나 되서 실내랑 옷에도 아낌없이 쓰고 있어요","5"
"51025409","4902824","2023-11-22","리기릿","레이어드 하기도 좋고 이거만으로도 쓰기 좋아용~~
향이 진짜 오래가고 탑노트는 상콤하고 베이스가 묵~직한 파우더향이나요

베이스가 파우더향이 나서 그런지 친구가 아기궁둥이향이 난대요ㅋㅋ
","5"
"50852403","4902824","2023-11-08","패션충혁","향이 아주 마음에 들어요 꾸민날에 향수로 포인트 주고 좋아요","5"
"49000062","4902824","2023-10-01","손민수민손","친구 선물로 줬더니 매우 좋아하네요
통이 이뻐요","5"
"48163818","4902824","2023-09-09","jhjhjhj1","향이 딱 플로럴향이라 뭔가 마음이 편해지는 느낌이에요","5"
"46144540","4902824","2023-08-28","ㅎㅂㅎㅎㄹ","포맨트중에 제일 좋아하는 향이라 다시 써보려고 구매했어요","5"
"47430753","4902824","2023-08-22","떠기떠아","시향해보고 구매했엉요 맘에들어요 남자친구도 향 좋다고 같이써요ㅋㅋ","5"
"46721204","4902824","2023-08-02","je214","향이 너무좋아요 지속력도 괜찮은거 같고
달달 상큼 해요","4"
"46394761","4902824","2023-07-24","Dushhw","생각보다 향이 오래안가서 아쉬웠어용 향도 엄청 좋다? 그런 느낌은 아니여서 재구매는 안할듯","5"
"46172409","4902824","2023-07-19","마녀83","사용한날에는 기분이 너무 좋아져요
사은품까지 너무 좋네요","5"
"45478252","4902824","2023-07-03","PoDoZam","향이 정말 좋습니다! 지속력도 오래가고 향 좋은 섬유유연제같은 냄새도 나고.. 인생향수 찾았어요..! 향수 처음 사시는 분들은 이거부터 써보시면 좋을듯","5"
"41226209","4902824","2023-03-31","모던한로마베레모","자주쓰는 향이라 좋아요 깔끔하고 학생이 쓰기 좋은거가타요","5"
"38017846","4902824","2023-01-11","뮬란0619","잔향 오래안가요  향수 20년 넘게 뿌렸는데 내가 오늘 향수를 안뿌렸나 할정도로 잔향 없네요 향기는 나쁘지는 않은데 잔향 아쉽네요  그리고 펌핑 잘안되요ㅡㅡ","1"
"36575391","4902824","2022-12-08","찌인블리","향 너무 좋아고 데일리로 잘 뿌리고 잇는뎅 
진짜 너무 좋아용!! ","5"
"35146766","4902824","2022-11-17","GREEN_1127","코튼메모리 향이 좋아서 재구매해요! 처음에는 강한듯했는데 쓰다보니 중독성 갑💚 사랑스럽고 발랄한 향이예요.","5"
"32577818","4902824","2022-09-19","뉴비빠","향수라서 혹시나 깨질까하고 걱정했었지만 안전하게 잘 도착했어요. 향은 워낙에 유명해서 좋은거 다들 아실꺼 같아요. 
부드러운 인상을 줄 수 있는 향인거 같아서 소개팅 갈때 뿌리면 상대방에게 좋은 향기로 기억될꺼 같아요.
다 쓰면 또 구매하러 올께요","5"
"29187336","4902824","2022-06-09","패쒠피풸","매장에서 시향 해보고 바로 구매 했습니당 :)
매장 보다 싸게 구매 했어요 ㅎㅎ ㅎㅎ ㅎㅎ
향이 진짜 취저 입니다 ㅠ ㅠ .. . 넘 조아유 ㅠ","5"
"27412629","4902824","2022-04-18","찐스타","정말 이름 그대로 향을 그대로 기억하게 되는 것이네요
너무 좋습니당. 남자인데 너무 좋아요","5"
"26358604","4902824","2022-03-17","라임리본","첫 향은 약간 복숭아? 잔 향은 샴푸나 바디워시 향같은 파우더리향이 너무 좋아요","5"
"25145274","4902824","2022-02-11","똥마렵ㄷㅏ","원래 갖고있는 향수랑 좀 비슷한거 같긴 하지만
워낙 좋아하는 향이라 괜찮아요
여름엔 못뿌리겠지만 가을 겨울에 뿌리기 너무 좋은 향수","5"
"74747600","4902824","2025-05-28","건강한광저우빅백","올영에서 시향 후 구매한 후기

요즘따라 향수를 들이고싶어서 폭풍 서치하다가 향은 직접 맡지 않는이상 호불호가 있을 수밖에 없다는 생각에 집 앞 올영으로 달려가서 이것저것 시향을 했어요! 하 .. 얼마나 뿌렷는지 어디에 뭘 뿌렸는지 다 까먹었는데 어디서 진짜 개 향기로운냄새가 나는 거예요 ㅠㅠ 근데 뭔지 모름..
그래서 다음 날 뭔지 찾으러 올영가서 하나씩 다 뿌리다가 찾았습니다,, 바로 코튼 메모리,,
향수같지 않아요! 뭔가 물먹 복숭아에 코튼향..? 인데 처음에 뿌릴 땐 좀 코를 찌르는데 시간 지나면 괜찮습니다. 샴푸같다고 하는 평이 공감이 되네요~ 뭔가 그 샴푸의 쎄한 꽃향기가 나면서 맑은 느낌입니다! 
고급진 느낌은 아니지만 충분히 매력있고 친근한 향이에요 ㅎㅎ 저만 뿌리고 싶네용 자연스럽고 기분 좋아지는 그런 향입니다.
양쪽 손목에 톡톡 , 머리카락에 한 번 뿌리면 괜찮아여

⛤ 코튼허그랑 비교할 때 코튼허그는 장롱에 박혀있던 섬유유연제 냄새나는 옷같았는데 얘는 상큼해서 더 좋습니다 .. 저만 알고싶지만.. 솔직리뷰.. ^^","5"
"73650616","4902824","2025-04-29","지우._.","시향해보고 너무 향이 좋아서
사버렸어요!!
평상시에 가볍게 뿌리고 나가기 좋을 거 같은
은은한 향이에요","5"
"73567310","4902824","2025-04-27","뽀잉갈","제 기준 여성스러운 향이에요 개인적으로 너무 여성스러운 향을 안좋아하는데 딱 은은적당하게 좋아요 봄에 잘 어울랴요","5"
"73515478","4902824","2025-04-25","힘있는뉴욕쿠션","애들이 이ㅜ향수 뿌리고 온 날마다 뭐 뿌리냐고 물어봄 ㅜㅜ 귯","5"
"73510430","4902824","2025-04-25","빙하왕","복숭아향은 잘 모르겠지만 향 자체는 좋아요 지속력도 적당해요","5"
"73174347","4902824","2025-04-15","웅장한울산후드티","뭔가 무난하게 어딜가나 뿌리고다닐 수 있는 향?? 가벼운 느낌이여서 좋아요 향은 복숭아+꽃 섞인 바디워시 냄새..?","5"
"73068738","4902824","2025-04-12","러브덕덕","병 바뀌고서는 처음 사보는데 병도 귀엽고 뭔가 중성적인 향이라고 해야하나 여튼 좋아요","5"
"73031922","4902824","2025-04-11","낙관적인명동마켓","두병째 사용중이예요
향이 강하지 않고, 여리여리한 향이 나서 데일리로 매일 쓰고 있는중입니다.","5"
"72969737","4902824","2025-04-09","적당히사자절약해","잔향이 진짜 너무 좋습니다ㅠㅠ 달달한 향은 아닌 것 같고 살짝 고급스러운 비누향? 플로럴향도 살짝 나면서 살냄새같은 꽃비누향으로 느껴졌습니다","5"
"72840917","4902824","2025-04-06","아쿵야아쿵","향도 좋고 디자인도 이쁘고 좋아요 지속력도 오래가고 넘 좋습니다","5"
"67420464","4902824","2024-11-24","유니크한전주엣지","처음 써봤는데 향이 너무 좋은거 같아요ㅎㅎ 다쓰면 재구매 할 생각 있습니다!","5"
"60840790","4902824","2024-06-16","마츠가네","향수제품이라 그냥 들고있는거 보여드립니다. ㅎㅎ 향은 플로럴하지만 과하지 않아서 중성적인 느낌이고요. 포맨트 향은 머리아픈향이 아니고 탑노트에 알코올향도 안나서 좋아요. 병도 너무 특이하지않아 더 좋아요. ㅎㅎ ","5"
"55691565","4902824","2024-02-17","or.hyeon","할인해서 삼만원이나 싸게 주고 삼요😋 케이스 예쁜 향수는 향도 좋은법.. 너무 맘에 들고 향이 너무 조아요💕💕💕","5"
"55637244","4902824","2024-02-16","baebaepsae","향이 너무 좋아여~ 한통 다 쓰고 재구매 합니당. 데일리로 굿","5"
"77717817","4902824","2025-08-18","RA123","제품이 너무 좋습니다~~~~
다음에도 구매해 잘 사용하겠습니다.^^
선물용으로도 너무 좋습니다!!!!! 이제는 제가 구매해서 사용하겠습니다","5"
"77716069","4902824","2025-08-18","예의바른도쿄벨트","제품이 너무 좋습니다~~~~
다음에도 구매해 잘 사용하겠습니다.^^
선물용으로도 너무 좋습니다!!!!! 이제는 제가 구매해서 사용하겠습니다","5"
"77624323","4902824","2025-08-13","Anhaejinnnnnnn","포맨트꺼 중에 이거는 처음 써봤는데 향이 좋아서 재구매 의사 있습니당ㅎㅎ","3"
"77603365","4902824","2025-08-13","너그러운동묘치크","향이너무 좋아요 지속력은 안 좋아여ㅠㅠ포멘트는 향 잘 뽑눈둣ㅋ","5"
"77549579","4902824","2025-08-10","단비뜌","패키지 바뀐게 더 고급져보이고 예뻐요 향도 너무 좋아요","5"
"77533878","4902824","2025-08-10","얄미운조지아레더","배송 빠르고 향도 너무 좋은데 지속력이 너무 짧아요ㅜㅜ","4"
"42545856","2027859","2023-05-02","체셔캣09","박스,패키지 모두 감성적이고 향의 퀄리티도 좋아요.  리얼하게 나무 타는 냄새와 달달한 바닐라향이 어우러져 약간 구어망드 느낌도 나요.","5"
"45746848","2027859","2023-07-08","joeykth","병부터 마음에들고
향도좋고 오래가서 엄청 만족합니다.","5"
"51266282","2027859","2023-11-17","소진임","직접 시향을 해보지 않아서 좀 두려웠는데 유튜브평 중에서 보험사에서 쓸 것 같은 향이라는 말이 있었는데 냄새 맡고 공감했습니다.. 솔직히 제 취향은 바카라나 머스크에 달달한 거라 그다지 마음에 들진 않았습니다. 근데 지속력은 좋은 것 같긴 해요. 추운 겨울에 뿌려주면 좋아요. 약간 진중한 느낌(중년미).. 이 들긴 합니다! 순둥한 이미지와 반대되는 분들께 어울려요! 근데 잔향이 진짜 좋음 ㅎㅎ 레이지랑 파이어플레이스보다 더 확실한 향(?) 입니다^_^","5"
"49790624","2027859","2023-10-17","maisono","마젤라향수 3번째 구매👈
재즈클럽 좋아하시면 이것도 조아하실맛 입니다 ! 군밤냄새와 장작타는 냄새가 섞여서 달달한 향이나요 
재즈는 우디가 강하다면 이건 단향이 강해요(^з^)-☆","5"
"45177600","2027859","2023-06-28","핑K","제 최애향입니다 쇼핑백까지 오고 저렴하게 사서 좋아요! 포근하면서 깨끗한향이에요","5"
"44864996","2027859","2023-06-23","OGJM","향 너무 좋아요 코코넛 향이 은은하게 퍼져요 바디워시 향 좋아하시는 분한테 딱인거 같아요!","5"
"49000688","2027859","2023-10-01","활동적인서울패드","향 완존완존 깨끗한 비누!!!!!! 향이에용 완존 깨끗해서 남녀상관없이 조을듯!!!","5"
"48313568","2027859","2023-09-13","지이이이이이이ㅣ우","꿍민수..
맡아보지도 않고 구매했는데
호불호 강하다더니 저는 극 호 입니드","5"
"48299993","2027859","2023-09-13","혜 밍","저는 머스크계열을 좋아하는 사람이지만 
임*균씨 손민수 하느라 사봤습니다 ㅎ~ .,ㅎ
호불호가 꽤 갈릴거같은 향입니다.. 
일단 향이 조금만 뿌려도 굉장히 세고 지속력도 좋아요 
먼가 청순한 사람보단 멋진.. 아우라가 풍기는 사람이 뿌리면 잘 어울릴 것 같아요
걍 
임창*씨에게 진짜 잘어울리는 향이네요 ♡. .","4"
"45770089","2027859","2023-07-09","Midwxst","향수는 독하고 티난다는 생각이 있었는데 
레이지선데이모닝은 은은하게 나서 좋아요 ㅎㅎ
호불호 딱히 안갈리는 향이라고 생각해요 ","5"
"54973452","2027859","2024-01-31","187200","저번에 신세계에서 한번 시향하고 맘에들어서 다른거 먼저사고 사야지 하다가 이제야 샀네요 향이 밝고 약간 비누향과 달달한 향이 나면서 나중에 가면 약간 시원한달달한 향이 나는거같아요","5"
"53416640","2027859","2023-12-20","양갱1411","향이 딱 제 취향이예요 샘플도 마움에 들고 보틀 디자인도 너무 귀여워요","5"
"53139286","2027859","2023-12-14","창의적인미국린넨","향이너무좋아요 방금 비누향 같기도하고 포근해요 너무  향도 너무강하지않아서 좋은데 오래가서 좋아요","5"
"42992753","2027859","2023-05-12","그리너리0","한 줄로 요약하자면 백화점 화장품 매장 가면 풍기는 그 익숙한 향입니다. 향수 설명 여기저기 찾아서 읽어보고 구매했는데 비누향 샤워 후 나는 향 이런 거 아니고 그냥 머리 안 아픈 포근한 화장품 향이에요. 머리 아프고 그런 향은 아닌데, 너&mdash;무 익숙항 향이라서 오히려 뿌리고 다니기 애매한.. 어쨌든 제 취향에는 안 맞았어요. 남자분들이 쓰시면 더 매력적일 것 같은 향이에요. 향 자체는 고급스러워서 격식 있는 자리에 갈 때 쓰면 좋을 것 같아요. 아 근데 너무 흔한 향임.. 저는 할인 받고 샀는데 제 값 주고 사기는 좀 아까워요. 작은 거 사길 잘 한 듯","3"
"41891277","2027859","2023-04-20","윤융이0726","원래 쓰던 향수인데 무신사에서 살 수 있어서 너무 좋아요! 샘플 향수도 써볼 수 있어서 좋았어요 포장도 꼼꼼하고 배송도 빨리왔어요","5"
"56308521","2027859","2024-03-02","자카룸","세일링 데이는 사람들이 의외로 잘 모르지만 데일리하게 뿌리기 정말 좋고 주변사람들도 뭐냐고 물어보는 향수에요","5"
"47088825","2027859","2023-08-12","무셔워","블라인드로 구매해봤는데 만족입니다 완전 가을 향인데 또 여름에 써도 괜찮아요","5"
"46421432","2027859","2023-07-25","개쌉가성비충","해당 제품 사용하고 모임갔었는데 친구들이 냄새 너무 좋다고 뭐냐고 엄청 물어봤어요 향이 넘 포근하고 행복하고 좋아요ㅜㅜ","5"
"46303477","2027859","2023-07-22","대구비둘기","시향해보고 산거라 더욱 더 만족합니다. 그리고 작은 샘플로 재즈클럽 향도 주셨는데 궁금했던 향이라서 너무 좋았습니다 !","5"
"45663731","2027859","2023-07-06","함뚱이","깡스타일리스트 유튜브 보고 알게되어서 구매를 했습니다!! 향도 좋고 여자친구도 좋다고 해요!!","5"
"45635901","2027859","2023-07-06","봄이였나","비누향이라기 보다는 꽃향에 더 가까운것 같고, 중성적인 향이 나요! 향은 사계절용으로 좋은것같아요~","5"
"52572034","2027859","2023-12-04","우유먹자","다른곳보다 무신사가 제일 저렴하더라구요 만족합니다","4"
"48198482","2027859","2023-09-10","김장베","임 그이를 손민수하고싶어서 고민한 향수인데 그래도 마음에 드는 향이면 좋겠다!!싶어서 매장 가서 직접 향을 맡고 무신사에사 세일하길래 구매했습니당! 친구들(모두 비흡연자)은 담배 냄새가 난다고 하는데 저(비흡연자, 담배 냄새를 극도로 싫어함)는 잘 모르겠더라고요&hellip;🫠 근데 처음에 맡을 땐 첫 향이 좀 스파이시한 느낌이었는데 시간이 지나니까 달달한 바닐라 향이 나면서 잔향이 미쳤어요. 정말로. 남자 향수라 좀 걱정했는데 시간이 지나니까 다들 잘 어울린다고 향 좋다고 그랬습니다! 사실 별로 안 뿌릴 줄 알고 30ml 샀는데 벌써 반이나 썼어요&hellip; &gt;&gt; 지속력이 조금 아쉽긴 합니다&hellip;&lt;&lt; 거의 다 쓸 때 쯤 100ml 사려구요 ! (계속 세일했으면 좋겠다..) 아 그리고 겨울이 정말 잘 어울릴 거 같은 향이지만 여름에 써도 부담 없는 향인거 같아요! 병도 너무 예쁩니다..💜","5"
"46007340","2027859","2023-07-14","thrasher3","본인이 쓰거나 이벤트할 때 빼고는
매장이나 공홈가서 사는거 추천합니다
특히 선물할거면 매장가서 사세요
쇼핑백 안옵니다 ","1"
"57795380","2027859","2024-04-10","commt","무난하게 매일 써도 될정도로 편안한 향입니다.
코가 피로하지않고 질리지 않아서 데일리로 뿌리기 딱 좋습니다.
겨울을 제외한 계절들이랑은 대부분 잘어울리고 시원하고 깔끔한 향이라서 해변으로 놀러갈때 뿌려도 좋을 것 같습니다.","5"
"56119039","2027859","2024-02-27","스 노 우 볼","향수 시향 해보고 샀는데요 너무 호인 향수였어요 우디에 물비린내가 섞인 머스크 베이스인 것 같은데요 사실 호가 아닌 사람들이 많을 향수라 희소성 있고 좋아요","4"
"53301220","2027859","2023-12-17","대담한서울숲미니","지속력이 좋네요~ 겨울에 뿌리기 좋은 코코넛향이네요 향수병도 예뻐서 인테리어 좋아요","4"
"51780878","2027859","2023-11-26","바그다드카페","패키징 디자인이 맘에 듭니다. 30ml라서 너무 귀여워요.
물론 째즈클럽이라 묵직할 것 같았는데 나름 달달한 바닐라향이 오래 남습니다. 그러면서도 베이스로 우디향도 느껴집니다.
샘플 향수도 두개 받아서 넘 좋았어요!","5"
"48064166","2027859","2023-09-07","0.오리","포장이 깔끔하게 오고 향은 되게 매력적이에요! 지속력도 오래가요!","5"
"45886553","2027859","2023-07-12","깔끔한보라색","편하게입고 나갔을때 잘 어울리는 향인것 같습니다
","5"
"45819389","2027859","2023-07-10","떠오르는혜성","평소 사용하던 불가리 향수 다쓰고 새로운 향의 향수 구매하려고 찾고 있었는데 산뜻한 향이라 평소에 뿌리고 다니기에 부담없는 해당 향수 구매하게 되었습니다! ","5"
"44967825","2027859","2023-06-25","구경나써","옛날에 시향해보고 사려했던데 품절이여서 찾아보니까 세일가로 살수있어서 좋았어요 첫향은 남자 스킨향이 좀 심한데 시간지나면 잔향이 은은하게 좋아서 여름향수로 딱이에여","5"
"44196454","2027859","2023-06-06","돈많아져서 옷사고싶다","마르지엘라 퍼퓸 뿌릴땨는 향이 정말 좋아요 잘쓸게요","5"
"43915095","2027859","2023-05-31","Pray0427","백화점에서 시향하고 샀는데
생각보단 향이 인위적인 진한 향이 나서 좀 실망했어요
무난한 향이고 지속력은 오래 가네요","4"
"55164967","2027859","2024-02-04","mumuuum","임남자의 향으로 유명한건 알고 있었는데
어쩌다 톡톡 뿌리고 나서 반해가지고 구매했어요 
독특하고 유지력도 장난아님 ㅜㅜ
남자향인진 몰랏는데 중성적? 아닝거같기도하고 
은은하게도 오래가서 전 만족합니다 패키지도 이쁘고 조아요","4"
"53462121","2027859","2023-12-21","faceZenly","두달쯤 써보면서 나갈때마다 향수 쓰는데 이틀정도는 레이지선데이모닝 뿌리는거같아요 데일리로 쓰기좋고 무난하고 지속력도 괜찮아서 다 쓰면 또 살거같네요","5"
"47244567","2027859","2023-08-17","딸기먹고싶움","향 진짜 너무 좋음 근데 생각해ㅛ던거보다 조금 더 작고 뚜껑 없는게 좀 아쉽지만 그래도 디자인도 이쁘고 향 ㄹㅇ 개좋음 근데 남자가 쓰는게 더 좋을거같은 향임 갠적 생각임  근데 구마넌..넘 비싸ㅠㅜ","5"
"44035647","2027859","2023-06-02","러비더비도비","백화점에서 맡아보고 향이 너무 좋아서 샀어요! 처음 뿌린향보다 개인적으로는 잔향이 훨씬 좋습니다!","5"
"55526570","2027859","2024-02-14","절제된남색컬렉션","향도 달달해소 너무 좋고 은은하게 꽃향기도 나서 거부감없이 뿌리고 있어요","5"
"55363177","2027859","2024-02-09","코디구경용","포장이 감성집니다. 향은 엄청 단 느낌이나요 유지력도 괜찮은듯해요. 중성적인 느낌인데 막 빡세게 꾸미는 느낌은 아니고 살짝 이지한 느낌이에요","5"
"54866135","2027859","2024-01-27","허풍안","향이 달달한데 은근 묵직한게, 중성적이고 좋아요!","5"
"53466555","2027859","2023-12-21","민팔이23","역시 믿고 쓰는 말젤라 향수 입니다 무신사에 입점 둬서 너무 좋네요!","5"
"53250277","2027859","2023-12-16","dheudnw","인생향수 입니다 처음에 나는 코코넛 향기에 시간이 지난 후 나는 달달한 냄새가 기분 좋아지게 합니다","5"
"53192424","2027859","2023-12-15","보라색폼폼이","향 너무 포근해요 데일리하게 사용 가능한 향이에요!! 남녀 노소 불문하고 호불호 없을 향입니다
다만 지속력이 길진 않아요&hellip;!","5"
"52218635","2027859","2023-11-30","불타는맛집","향수 고민하다 질렀습니다
뿌리니까 호불호없이 맑은느낌의 향나서 좋아욧 
사이즈는 립밤크기네요","5"
"51491128","2027859","2023-11-23","비선형적인대란템","클린웜코튼보다 더 좋네요 데일리로 무난합니다","5"
"51076331","2027859","2023-11-13","쿠세미","백화점에서 시향 후 구매했는데, 보다 할인된 가격에 샘플까지 주니까 너무 좋네요
발향력, 지속력 아주 굳입니다","5"
"50812764","2027859","2023-11-08","oldfashioned","코코넛이 느껴지는 비누 향입니다. 사계절 어느 때나 무난하게 사용 가능할 것 같아요","4"
"49681119","2027859","2023-10-14","gguX2","포도처럼 달달한 과일향이 맘에 들어서 구매했습니다! 향 표현도 좋고 지속도 꽤 가서 같은 브랜드로 모으고 있어요 :)","5"
"49665542","2027859","2023-10-14","jean$","향이 너무 좋아요 지속력이 진짜 좋아서 이틀정도 가요","4"
"48854623","2027859","2023-09-27","열심인홍대라펠","메종 마르지엘라 향수의 시그니처라고 불리는 재즈 클럽 럼 향은 약간 과일 향 같고 시거 향의 우디 향 처럼 느껴 집니다 마르지엘라 대표 향이라고 불리우는 만큼 향이 좋고 지속력도 좋네요","5"
"48494251","2027859","2023-09-18","jughfgd","7.7에 구매함. 근데 샘플 두 개 중에 한 개가 겹쳐버림","5"
"48385323","2027859","2023-09-15","Madhatt","향 너무 좋아요 맨날맨날 뿌려요
지속력은 5시간 정도에요
하룻밤자면 잔향마저 없어져요","5"
"47792736","2027859","2023-08-31","힘을내요 슈퍼파월","지속력도 좋고 여름에 뿌리기 좋습니다.!
약간 시원하면서 과일향입니다.","5"
"47440866","2027859","2023-08-22","Harumi","꿍민수하려고 샀는데 이 향은 색시다이너마이트 꿍떤남자한테 어울리는 향같고 내가뿌리니까 진짜 ","5"
"46646911","2027859","2023-07-31","이징기징기","오드뚜왈렛이라 지속력 약한건 예상했어요 근데 향이 너무 좋아요 침구에 뿌리고 자면 너무 좋을거같아요!
4계절 뿌리기도 좋아요","5"
"46256710","2027859","2023-07-20","znfznf","아주 무난한 향이고, 계절감 없이 편히 쓸 수 있는 향수 같아요. 지속이나 발산은 약한 편이지만 무난합니다
","5"
"51690056","2512890","2023-12-25","오은결_","생각보다 향이 좋은데 사이즈가 너무 작은 거 같아서 아쉬워요","3"
